https://www.amazon.in/sspa/click?ie=UTF8&spc=MTo1MzI5MDA3NTg2NTI4NTk5OjE2OTI3OTQ3Nzg6c3BfYXRmOjMwMDA0MDI3NTU2NTEzMjo6MDo6&url=%2FDanyell-Davis-Unisex-Leather-Backpack%2Fdp%2FB0BWNGMHKJ%2Fref%3Dsr_1_2_sspa%3Fcrid%3D2M096C61O4MLT%26keywords%3Dbags%26qid%3D1692794778%26sprefix%3Dba%252Caps%252C283%26sr%3D8-2-spons%26sp_csd%3Dd2lkZ2V0TmFtZT1zcF9hdGY%26psc%3D1,Danyell Davis Unisex Leather Casual Laptop Backpack (Tan),"5,999",5.0,1
https://www.amazon.in/Skybags-Brat-Black-Casual-Backpack/dp/B08Z1HHHTD/ref=sr_1_3?crid=2M096C61O4MLT&keywords=bags&qid=1692794778&sprefix=ba%2Caps%2C283&sr=8-3,Skybags Brat Black 46 Cms Casual Backpack,669,4.1,"5,550"
https://www.amazon.in/TRUE-HUMAN-Anti-Theft-backpack-charging/dp/B09QJ7ZF2Y/ref=sr_1_4?crid=2M096C61O4MLT&keywords=bags&qid=1692794778&sprefix=ba%2Caps%2C283&sr=8-4,TRUE HUMAN EMPEROR® Anti-Theft backpack With USB charging Port Laptop bag/Office bag/college bag/travel bag with anti -theft back pocket (LEGEND),599,3.7,"2,467"
https://www.amazon.in/Half-Moon-Waterproof-Backpack-Students/dp/B085MHDJ93/ref=sr_1_5?crid=2M096C61O4MLT&keywords=bags&qid=1692794778&sprefix=ba%2Caps%2C283&sr=8-5,"Half Moon 35 Ltrs Water Resistant 15.6 inch Laptop Bag for Men/Backpack for Men, Navy Blue | Office Bag for Men/Office Bag for Women with Padded Laptop Compartment | Rain Cover & Reflective Strips",649,3.9,"16,986"
https://www.amazon.in/Lunars-Bingo-Laptop-Resistant-48L/dp/B08YZ8FFBZ/ref=sr_1_6?crid=2M096C61O4MLT&keywords=bags&qid=1692794778&sprefix=ba%2Caps%2C283&sr=8-6,Lunar's Bingo - 48 L Laptop Office/School/Travel/Business Backpack Water Resistant - Fits Up to 15.6 Inch Laptop Notebook with 1 Year Warranty,819,3.9,"10,111"
https://www.amazon.in/American-Tourister-AMT-SCH-02/dp/B07CJCGM1M/ref=sr_1_7?crid=2M096C61O4MLT&keywords=bags&qid=1692794778&sprefix=ba%2Caps%2C283&sr=8-7,American Tourister Fizz Large Size 32 Ltrs Casual Backpack (BLACK),"1,199",4.0,"55,290"
https://www.amazon.in/Rucksack-Travel-Backpack-Trekking-Compartment/dp/B07YDGQQN5/ref=sr_1_8?crid=2M096C61O4MLT&keywords=bags&qid=1692794778&sprefix=ba%2Caps%2C283&sr=8-8,"Fur Jaden 55 LTR Rucksack Travel Backpack Bag for Trekking, Hiking with Shoe Compartment",849,4.3,"5,610"
https://www.amazon.in/Half-Moon-Backpack-Luggage-Compartment/dp/B09VCLZ3K4/ref=sr_1_9?crid=2M096C61O4MLT&keywords=bags&qid=1692794778&sprefix=ba%2Caps%2C283&sr=8-9,Half Moon Large 37L Laptop Bag Backpack for menं Women Boys and Girls Luggage Travel Bags with 17.3 inches Laptop Compartment & Rain Cover,849,3.9,"3,459"
https://www.amazon.in/Wesley-Milestone-Waterproof-Backpack-Business/dp/B084JGJ8PF/ref=sr_1_10?crid=2M096C61O4MLT&keywords=bags&qid=1692794778&sprefix=ba%2Caps%2C283&sr=8-10,Wesley Milestone 2.0 Casual Waterproof Laptop Backpack/Office Bag/School Bag/College Bag/Business Bag/Travel Backpack (Dimensions:13x18 inches) (Compatible with 39.62cm(15.6inch laptop) 30 L (Blue & black),550,4.3,"12,382"
https://www.amazon.in/sspa/click?ie=UTF8&spc=MTo1MzI5MDA3NTg2NTI4NTk5OjE2OTI3OTQ3Nzg6c3BfbXRmOjIwMTI3NjgzODcyMzk4OjowOjo&url=%2FUPPERCASE-Professional-Backpack-resistant-sustainable%2Fdp%2FB0BXFDK5J2%2Fref%3Dsr_1_11_sspa%3Fcrid%3D2M096C61O4MLT%26keywords%3Dbags%26qid%3D1692794778%26sprefix%3Dba%252Caps%252C283%26sr%3D8-11-spons%26sp_csd%3Dd2lkZ2V0TmFtZT1zcF9tdGY%26psc%3D1,"uppercase 26 Ltrs Ryder Professional Laptop Backpack (15.6 Inch) 3x more water resistant sustainable bags with rain proof zippers for Men, Women, Boys and Girls, 750 Days warranty","2,400",4.3,78
https://www.amazon.in/sspa/click?ie=UTF8&spc=MTo1MzI5MDA3NTg2NTI4NTk5OjE2OTI3OTQ3Nzg6c3BfbXRmOjIwMDYzNzg0NDU4Mzk4OjowOjo&url=%2Fuppercase-Backpack-2300EBP1-repellent-sustainable%2Fdp%2FB0B69M182Q%2Fref%3Dsr_1_12_sspa%3Fcrid%3D2M096C61O4MLT%26keywords%3Dbags%26qid%3D1692794778%26sprefix%3Dba%252Caps%252C283%26sr%3D8-12-spons%26sp_csd%3Dd2lkZ2V0TmFtZT1zcF9tdGY%26psc%3D1,"uppercase Medium 17 Ltrs Vegan Leather (upto 14 inch) Laptop Backpack 2300EBP1 3x more water resistant sustainable bags with rain proof zippers for Men, Women, Boys and Girls, 750 Days warranty","1,600",4.0,540
https://www.amazon.in/SFANE-Duffel-Shoulder-Women-Compartment/dp/B07XXFB9CZ/ref=sr_1_13?crid=2M096C61O4MLT&keywords=bags&qid=1692794778&sprefix=ba%2Caps%2C283&sr=8-13,Sfane Polyester 23cms Duffle/Shoulder/Gym Bag for Men & Women with Separate Shoe Compartment (Grey),387,4.3,"7,931"
https://www.amazon.in/Number-Backpack-Compartment-Charging-Organizer/dp/B09VTDMRY7/ref=sr_1_14?crid=2M096C61O4MLT&keywords=bags&qid=1692794778&sprefix=ba%2Caps%2C283&sr=8-14,"FUR JADEN Anti Theft Number Lock Backpack Bag with 15.6 Inch Laptop Compartment, USB Charging Port & Organizer Pocket for Men Women Boys Girls",679,4.0,"5,655"
https://www.amazon.in/Backpack-Small-Black-Water-Repellant/dp/B088XB5XY8/ref=sr_1_15?crid=2M096C61O4MLT&keywords=bags&qid=1692794778&sprefix=ba%2Caps%2C283&sr=8-15,"Mi Step Out 12 L Mini Backpack (Small Size, Black, Water Repellant)",249,4.1,"9,714"
https://www.amazon.in/FUR-JADEN-Leatherette-Polypropylene-DUFF05/dp/B07M9BRCQ5/ref=sr_1_16?crid=2M096C61O4MLT&keywords=bags&qid=1692794778&sprefix=ba%2Caps%2C283&sr=8-16,Fur Jaden Brown Textured Leatherette Stylish & Spacious Weekender Duffle Bag for Travel,899,4.3,"6,520"
https://www.amazon.in/Lenovo-15-6-Inches-Everyday-Backpack/dp/B08R7RPVJF/ref=sr_1_17?crid=2M096C61O4MLT&keywords=bags&qid=1692794778&sprefix=ba%2Caps%2C283&sr=8-17,"Lenovo 15.6"" (39.62cm) Slim Everyday Backpack, Made in India, Compact, Water-resistant, Organized storage:Laptop sleeve,tablet pocket,front workstation,2-side pockets,Padded adjustable shoulder straps",399,4.3,"4,241"
https://www.amazon.in/GEAR-Black-Blue-Backpack-years/dp/B019HA8AYG/ref=sr_1_18?crid=2M096C61O4MLT&keywords=bags&qid=1692794778&sprefix=ba%2Caps%2C283&sr=8-18,Gear CarryOn 16L Foldable Water Resistant School Bag//Backpack/College Bag for Men/Women - Blue Black,199,3.7,"7,067"
https://www.amazon.in/Wesley-Spartan-Hiking-Raincover-Organiser/dp/B098QFF5TJ/ref=sr_1_19?crid=2M096C61O4MLT&keywords=bags&qid=1692794778&sprefix=ba%2Caps%2C283&sr=8-19,Wesley Spartan Unisex Travel Hiking Laptop Bag fits Upto 17.3 inch with Raincover and Internal Organiser Backpack Rucksack College Bag,749,4.1,"1,718"
https://www.amazon.in/Arctic-Fox-Liters-String-Backpack/dp/B08L6Q9V1H/ref=sr_1_20?crid=2M096C61O4MLT&keywords=bags&qid=1692794778&sprefix=ba%2Caps%2C283&sr=8-20,Arctic Fox 15 Liters Draw String Bag Lavender Backpack,209,4.2,"3,528"
https://www.amazon.in/sspa/click?ie=UTF8&spc=MTo1MzI5MDA3NTg2NTI4NTk5OjE2OTI3OTQ3Nzg6c3BfYnRmOjIwMDk3NTc5NTAxNzk4OjowOjo&url=%2FUppercase-Medium-Laptop-Backpack-2100Ebp1%2Fdp%2FB0B691HSL3%2Fref%3Dsr_1_21_sspa%3Fcrid%3D2M096C61O4MLT%26keywords%3Dbags%26qid%3D1692794778%26sprefix%3Dba%252Caps%252C283%26sr%3D8-21-spons%26sp_csd%3Dd2lkZ2V0TmFtZT1zcF9idGY%26psc%3D1,uppercase 14 Ltrs Medium (14.6 Inch) Laptop Backpack 2100EBP1 Roll Top Office College 3x More Water Repellent Sustainable Bags With Rainproof Zippers For Unisex,"1,000",4.2,180
https://www.amazon.in/sspa/click?ie=UTF8&spc=MTo1MzI5MDA3NTg2NTI4NTk5OjE2OTI3OTQ3Nzg6c3BfYnRmOjIwMTI1ODk5OTIwNjk4OjowOjo&url=%2FUppercase-Professional-Backpack-Resistant-Sustainable%2Fdp%2FB0BWNBQXDZ%2Fref%3Dsr_1_22_sspa%3Fcrid%3D2M096C61O4MLT%26keywords%3Dbags%26qid%3D1692794778%26sprefix%3Dba%252Caps%252C283%26sr%3D8-22-spons%26sp_csd%3Dd2lkZ2V0TmFtZT1zcF9idGY%26psc%3D1,"uppercase Apex Professional Laptop Backpack (15.6 Inch) 3x more water resistant sustainable bags with rain proof zippers for Men, Women, Boys and Girls, 750 Days warranty","1,800",4.4,89
https://www.amazon.in/sspa/click?ie=UTF8&spc=MTo0MjMzNDk1NTkxMDE0NTk5OjE2OTI3OTQ3ODE6c3BfYXRmX25leHQ6MjAxNTM5NjI0MjE0OTg6OjA6Og&url=%2FFUR-JADEN-Anti-Theft-Backpack-Professionals%2Fdp%2FB0C28QQMFJ%2Fref%3Dsr_1_17_sspa%3Fcrid%3D2M096C61O4MLT%26keywords%3Dbags%26qid%3D1692794781%26sprefix%3Dba%252Caps%252C283%26sr%3D8-17-spons%26sp_csd%3Dd2lkZ2V0TmFtZT1zcF9hdGZfbmV4dA%26psc%3D1,FUR JADEN Pro Series Smart Tech Anti-Theft Laptop Backpack With USB-A and USB-C Type Charging Port for Men & Women For Business Professionals & College Students,"3,499",4.6,99
https://www.amazon.in/sspa/click?ie=UTF8&spc=MTo0MjMzNDk1NTkxMDE0NTk5OjE2OTI3OTQ3ODE6c3BfYXRmX25leHQ6MjAwNjU1MzM2ODQ2OTg6OjA6Og&url=%2FUppercase-Medium-Size-Backpack-_Blue%2Fdp%2FB0B81YTTWS%2Fref%3Dsr_1_18_sspa%3Fcrid%3D2M096C61O4MLT%26keywords%3Dbags%26qid%3D1692794781%26sprefix%3Dba%252Caps%252C283%26sr%3D8-18-spons%26sp_csd%3Dd2lkZ2V0TmFtZT1zcF9hdGZfbmV4dA%26psc%3D1,"uppercase Medium 23 Ltrs Tall Boy (14.6 inch) Laptop Backpack 2500EBP1 3x more water resistant sustainable bag with rain proof zippers for Men, Women, Boys and Girls, 750 Days warranty","1,700",4.0,269
https://www.amazon.in/WILDHORN-Backpack-Compartment-Business-Stitching/dp/B09QL66G55/ref=sr_1_19?crid=2M096C61O4MLT&keywords=bags&qid=1692794781&sprefix=ba%2Caps%2C283&sr=8-19,"WILDHORN 31L Laptop Backpack for Men/Women I Fits upto 15.6"" Laptop I Waterproof I Travel/Business/College Bookbags",599,4.1,"1,621"
https://www.amazon.in/Gear-Classic-Leather-Backpack-LBPCLSLTH0201/dp/B07G4F6XFH/ref=sr_1_20?crid=2M096C61O4MLT&keywords=bags&qid=1692794781&sprefix=ba%2Caps%2C283&sr=8-20,Gear Classic 20L Small Size Faux Leather Water Resistant Anti Theft Unisex Laptop Backpack- Brown,979,4.4,"6,046"
https://www.amazon.in/Lavie-Sport-Duffle-Luggage-Trolley/dp/B097RJ22Q3/ref=sr_1_21?crid=2M096C61O4MLT&keywords=bags&qid=1692794781&sprefix=ba%2Caps%2C283&sr=8-21,Lavie Sport Lino Large Size 63 cms Wheel Duffle Bag for Travel | Travel Bag with Trolley,"1,049",4.0,"8,334"
https://www.amazon.in/ZIPLINE-Polyester-Backpack-Children-Daypack/dp/B07XVMR33Q/ref=sr_1_22?crid=2M096C61O4MLT&keywords=bags&qid=1692794781&sprefix=ba%2Caps%2C283&sr=8-22,Zipline Unisex casual polyester 36 L Backpack School Bag Women Men Boys Girls children Daypack College Bag Book School Sports Bag Weekend Bag,843,4.0,"6,350"
https://www.amazon.in/ADISA-Laptop-Backpack-Office-College/dp/B09TPX22NF/ref=sr_1_23?crid=2M096C61O4MLT&keywords=bags&qid=1692794781&sprefix=ba%2Caps%2C283&sr=8-23,ADISA 15.6 inch laptop backpack office bag college travel back pack 32 Ltrs,499,3.9,"1,159"
https://www.amazon.in/Safari-45L-21-OB-BLK/dp/B07BZ5VC4H/ref=sr_1_24?crid=2M096C61O4MLT&keywords=bags&qid=1692794781&sprefix=ba%2Caps%2C283&sr=8-24,Safari Seek 45 Ltrs Overnighter Expandable Travel Laptop Backpack,"2,139",4.5,"7,394"
https://www.amazon.in/School-school-partition-Collage-Backpack/dp/B09NNYCQ1Q/ref=sr_1_25?crid=2M096C61O4MLT&keywords=bags&qid=1692794781&sprefix=ba%2Caps%2C283&sr=8-25,URBAN CARRIER School Bag For girls school bags for boys Class 5-10 Large 4 partition 45 L Laptop Collage Office Travel Unisex Backpack,431,3.5,"1,090"
https://www.amazon.in/TRUE-Emperor-Anti-Theft-backpack-charging/dp/B0BYB631NR/ref=sr_1_26?crid=2M096C61O4MLT&keywords=bags&qid=1692794781&sprefix=ba%2Caps%2C283&sr=8-26,"TRUE HUMAN® Emperor Anti-Theft Pocket backpack With USB charging Port Laptop,office,college,travel bag for men and women(Epower)",599,3.6,266
https://www.amazon.in/sspa/click?ie=UTF8&spc=MTo0MjMzNDk1NTkxMDE0NTk5OjE2OTI3OTQ3ODE6c3BfbXRmOjIwMDYzNzg0NDU4MDk4OjowOjo&url=%2Fuppercase-Backpack-2300EBP1-repellent-sustainable%2Fdp%2FB0B68Z3X7D%2Fref%3Dsr_1_27_sspa%3Fcrid%3D2M096C61O4MLT%26keywords%3Dbags%26qid%3D1692794781%26sprefix%3Dba%252Caps%252C283%26sr%3D8-27-spons%26sp_csd%3Dd2lkZ2V0TmFtZT1zcF9tdGY%26psc%3D1,"uppercase Medium 17 Ltrs Vegan Leather (upto 14 inch) Laptop Backpack 2300EBP1 3x more water resistant sustainable bags with rain proof zippers for Men, Women, Boys and Girls, 750 Days warranty","1,600",4.0,540
https://www.amazon.in/sspa/click?ie=UTF8&spc=MTo0MjMzNDk1NTkxMDE0NTk5OjE2OTI3OTQ3ODE6c3BfbXRmOjIwMTA1NzE1ODIxNTk4OjowOjo&url=%2Fuppercase-Professional-resistant-sustainable-Anti-theft%2Fdp%2FB0BR1C59R8%2Fref%3Dsr_1_28_sspa%3Fcrid%3D2M096C61O4MLT%26keywords%3Dbags%26qid%3D1692794781%26sprefix%3Dba%252Caps%252C283%26sr%3D8-28-spons%26sp_csd%3Dd2lkZ2V0TmFtZT1zcF9tdGY%26psc%3D1,"uppercase SealPro Professional Laptop Backpack (15.6 Inch) 3x more water resistant sustainable bags with rain proof zippers & Anti-theft for Men, Women, Boys and Girls, 750 Days warranty","1,900",4.5,78
https://www.amazon.in/Gear-Black-Laptop-Backpack-LBPASPIRE0104/dp/B075MK4TXP/ref=sr_1_29?crid=2M096C61O4MLT&keywords=bags&qid=1692794781&sprefix=ba%2Caps%2C283&sr=8-29,Gear Aspire 30L Water Restant Office Laptop Bag/Backpack for Men/Women/(Black),"1,115",4.3,"6,167"
https://www.amazon.in/Zipline-Nexa-Resistant-Bagpack-Backpack/dp/B08WQ668WJ/ref=sr_1_30?crid=2M096C61O4MLT&keywords=bags&qid=1692794781&sprefix=ba%2Caps%2C283&sr=8-30,Zipline Unisex Casual Polyester 36 L Backpack School Bag Women Men Boys Girls Children Daypack College Bag Book School Sports Bag,843,3.6,914
https://www.amazon.in/LOOKMUSTER-Waterproof-Backpack-College-Business/dp/B0BZW8KW18/ref=sr_1_31?crid=2M096C61O4MLT&keywords=bags&qid=1692794781&sprefix=ba%2Caps%2C283&sr=8-31,LOOKMUSTER (15.6 inch 30 L Casual Waterproof Laptop Backpack/Office Bag/School Bag/College Bag/Business Bag/Unisex Travel Backpack,439,3.7,55
https://www.amazon.in/Number-Backpack-Compartment-Charging-Organizer/dp/B09VTCNN75/ref=sr_1_32?crid=2M096C61O4MLT&keywords=bags&qid=1692794781&sprefix=ba%2Caps%2C283&sr=8-32,"FUR JADEN Anti Theft Number Lock Backpack Bag with 15.6 Inch Laptop Compartment, USB Charging Port & Organizer Pocket for Men Women Boys Girls",679,4.0,"5,655"
https://www.amazon.in/Safari-Laptop-Backpack-Resistant-Fabric/dp/B09B25Z8M2/ref=sr_1_33?crid=2M096C61O4MLT&keywords=bags&qid=1692794781&sprefix=ba%2Caps%2C283&sr=8-33,Safari Quill Large Laptop Backpack 26 Ltrs Water Resistant Fabric - Black,859,3.9,"1,033"
https://www.amazon.in/Fur-Jaden-Black-Waterproof-Backpack/dp/B078GLXMDY/ref=sr_1_34?crid=2M096C61O4MLT&keywords=bags&qid=1692794781&sprefix=ba%2Caps%2C283&sr=8-34,FUR JADEN Anti Theft Backpack 15.6 Inch Laptop Bag with USB Charging Port For Men Women Boys Girls,839,4.0,"13,945"
https://www.amazon.in/American-Tourister-BACKPACK-COMPARTMENT-ORGANIZER/dp/B0BTD4S4XF/ref=sr_1_35?crid=2M096C61O4MLT&keywords=bags&qid=1692794781&sprefix=ba%2Caps%2C283&sr=8-35,"American Tourister VALEX BLACK LAPTOP BACKPACK 28 Ltrs,Volume, LAPTOP COMPARTMENT, BOTTLE POCKET, FRONT ORGANIZER","1,399",4.3,868
https://www.amazon.in/American-Tourister-BACKPACK-COMPARTMENT-ORGANIZER/dp/B0BTD4FK9G/ref=sr_1_36?crid=2M096C61O4MLT&keywords=bags&qid=1692794781&sprefix=ba%2Caps%2C283&sr=8-36,"American Tourister VALEX BLUE LAPTOP BACKPACK 28 Ltrs,Volume, LAPTOP COMPARTMENT, BOTTLE POCKET, FRONT ORGANIZER","1,399",4.2,678
https://www.amazon.in/sspa/click?ie=UTF8&spc=MTo0MjMzNDk1NTkxMDE0NTk5OjE2OTI3OTQ3ODE6c3BfYnRmOjIwMDk3NjEyMjMxNjk4OjowOjo&url=%2Fuppercase-Backpack-1800EBP1-resistant-sustainable%2Fdp%2FB0B9T4YDPX%2Fref%3Dsr_1_37_sspa%3Fcrid%3D2M096C61O4MLT%26keywords%3Dbags%26qid%3D1692794781%26sprefix%3Dba%252Caps%252C283%26sr%3D8-37-spons%26sp_csd%3Dd2lkZ2V0TmFtZT1zcF9idGY%26psc%3D1,"uppercase Laptop Backpack Printed Compact 3x more water repellent sustainable bags with rain proof zippers for Men, Women, Boys & Girls(Pink)","1,200",4.4,35
https://www.amazon.in/sspa/click?ie=UTF8&spc=MTo0MjMzNDk1NTkxMDE0NTk5OjE2OTI3OTQ3ODE6c3BfYnRmOjIwMTUyNzQwNjAwOTk4OjowOjo&url=%2FRed-Lemon-Ironlook-Briefcase-Anti-Theft%2Fdp%2FB09ZYQJHXR%2Fref%3Dsr_1_38_sspa%3Fcrid%3D2M096C61O4MLT%26keywords%3Dbags%26qid%3D1692794781%26sprefix%3Dba%252Caps%252C283%26sr%3D8-38-spons%26sp_csd%3Dd2lkZ2V0TmFtZT1zcF9idGY%26psc%3D1,Red Lemon Bange Hard Ironlook Briefcase Laptop Bag Anti-Theft Hard Shell Unisex Laptop Backpack with USB Charging Backpack for Men and Women,"4,990",4.4,108
https://www.amazon.in/sspa/click?ie=UTF8&spc=MTo2NjA0ODE4MzgwOTg1OTk6MTY5Mjc5NDc4NTpzcF9hdGZfbmV4dDoyMDEwNTQ1MTg1MTU5ODo6MDo6&url=%2Fuppercase-Professional-Backpack-resistant-sustainable%2Fdp%2FB0BR1D4SL1%2Fref%3Dsr_1_33_sspa%3Fcrid%3D2M096C61O4MLT%26keywords%3Dbags%26qid%3D1692794785%26sprefix%3Dba%252Caps%252C283%26sr%3D8-33-spons%26sp_csd%3Dd2lkZ2V0TmFtZT1zcF9hdGZfbmV4dA%26psc%3D1,"uppercase Apex Professional Laptop Backpack (15.6 Inch) 3x more water resistant sustainable bags with rain proof zippers for Men, Women, Boys and Girls, 750 Days warranty","1,800",4.4,89
https://www.amazon.in/sspa/click?ie=UTF8&spc=MTo2NjA0ODE4MzgwOTg1OTk6MTY5Mjc5NDc4NTpzcF9hdGZfbmV4dDoyMDA2NTUzMzY4NDU5ODo6MDo6&url=%2Fuppercase-ltrs-backpack-INVALID-DATA_red%2Fdp%2FB0B81WST7X%2Fref%3Dsr_1_34_sspa%3Fcrid%3D2M096C61O4MLT%26keywords%3Dbags%26qid%3D1692794785%26sprefix%3Dba%252Caps%252C283%26sr%3D8-34-spons%26sp_csd%3Dd2lkZ2V0TmFtZT1zcF9hdGZfbmV4dA%26psc%3D1,"uppercase Medium 23 Ltrs Tall Boy (14.6 inch) Laptop Backpack 2500EBP1 3x more water resistant sustainable bag with rain proof zippers for Men, Women, Boys and Girls, 750 Days warranty","1,700",4.0,269
https://www.amazon.in/SAFARI-Ltrs-Casual-Backpack-DAYPACKNEO15CBSEB/dp/B07Q7CNPMV/ref=sr_1_35?crid=2M096C61O4MLT&keywords=bags&qid=1692794785&sprefix=ba%2Caps%2C283&sr=8-35,Safari Compact Size 15 Ltrs Casual Backpack For Unisex Adult - Sea Blue,329,4.0,"20,514"
https://www.amazon.in/FATMUG-Laptop-Bag-Men-Convertible/dp/B084LF4RT5/ref=sr_1_36?crid=2M096C61O4MLT&keywords=bags&qid=1692794785&sprefix=ba%2Caps%2C283&sr=8-36,"FATMUG Laptop Bag For Men - Convertible Backpack For Office And Travel (Dark Grey,Oxford Fabric)","1,699",4.4,"2,325"
https://www.amazon.in/WILDHORN-Backpack-Compartment-Business-Stitching/dp/B09QL81ZHB/ref=sr_1_37?crid=2M096C61O4MLT&keywords=bags&qid=1692794785&sprefix=ba%2Caps%2C283&sr=8-37,"WILDHORN 31L Laptop Backpack for Men/Women I Fits upto 15.6"" Laptop I Waterproof I Travel/Business/College Bookbags",599,4.1,"1,621"
https://www.amazon.in/Half-Moon-Backpack-Spacious-Multiple/dp/B0C23Z9W18/ref=sr_1_38?crid=2M096C61O4MLT&keywords=bags&qid=1692794785&sprefix=ba%2Caps%2C283&sr=8-38,Half Moon Aztec 37L School Bag Class 5-12 | College Bagpack for Men/College Back pack for Women | 15.6 inch Laptop Bag for Men/Backpack for Men | Spacious & Multiple Pockets,649,3.6,237
https://www.amazon.in/Wesley-Milestone-Waterproof-Backpack-Business/dp/B085S444JV/ref=sr_1_39?crid=2M096C61O4MLT&keywords=bags&qid=1692794785&sprefix=ba%2Caps%2C283&sr=8-39,"Wesley Milestone 2.0 Casual Waterproof Laptop Backpack/Office Bag/School Bag/College Bag/Business Bag/Travel Backpack (Dimensions:13x18 inches) (Compatible with 39.62cm(15.6inch laptop) 30 L, Charcoal black",550,4.3,"12,382"
https://www.amazon.in/ADISA-BP004-Weight-Casual-Backpack/dp/B07G3CG9FC/ref=sr_1_40?crid=2M096C61O4MLT&keywords=bags&qid=1692794785&sprefix=ba%2Caps%2C283&sr=8-40,ADISA Laptop Backpack 31 Ltrs,399,4.0,"9,048"
https://www.amazon.in/ADISA-BP005-Weight-Casual-Backpack/dp/B07F3X45WZ/ref=sr_1_41?crid=2M096C61O4MLT&keywords=bags&qid=1692794785&sprefix=ba%2Caps%2C283&sr=8-41,ADISA Light Weight Laptop Backpack 32 Ltrs,499,4.0,"6,092"
https://www.amazon.in/Lunars-V-Line-Resistant-Bagpack-College/dp/B08BP5CYDV/ref=sr_1_42?crid=2M096C61O4MLT&keywords=bags&qid=1692794785&sprefix=ba%2Caps%2C283&sr=8-42,"Lunar's V-Line Backpack for Men, Blue | 35L Water Resistant School Bags for Boys | Stylish, & Durable | College Bags for Men/College Bag for Girls | 1 Yr Warranty",735,4.1,"2,687"
https://www.amazon.in/sspa/click?ie=UTF8&spc=MTo2NjA0ODE4MzgwOTg1OTk6MTY5Mjc5NDc4NTpzcF9tdGY6MjAxMTIwOTYzMTc1OTg6OjA6Og&url=%2Fuppercase-Professional-Anti-theft-resistant-sustainable%2Fdp%2FB0BSH4H4DB%2Fref%3Dsr_1_43_sspa%3Fcrid%3D2M096C61O4MLT%26keywords%3Dbags%26qid%3D1692794785%26sprefix%3Dba%252Caps%252C283%26sr%3D8-43-spons%26sp_csd%3Dd2lkZ2V0TmFtZT1zcF9tdGY%26psc%3D1,"uppercase Matrix Professional Anti-theft Laptop Backpack (15.6 Inch) 3x more water resistant sustainable bags with rain proof zippers for Men, Women, Boys and Girls, 750 Days warranty","2,300",4.2,63
https://www.amazon.in/sspa/click?ie=UTF8&spc=MTo2NjA0ODE4MzgwOTg1OTk6MTY5Mjc5NDc4NTpzcF9tdGY6MjAwNjMzNjA1NjU2OTg6OjA6Og&url=%2FMartucci-Waterproof-Backpack-College-Business%2Fdp%2FB0B1HM2ZGX%2Fref%3Dsr_1_44_sspa%3Fcrid%3D2M096C61O4MLT%26keywords%3Dbags%26qid%3D1692794785%26sprefix%3Dba%252Caps%252C283%26sr%3D8-44-spons%26sp_csd%3Dd2lkZ2V0TmFtZT1zcF9tdGY%26psc%3D1,Martucci 16 inch 36L Casual Waterproof Backpack/Office Bag/School Bag/College Bag/Business Bag/Unisex Travel Backpack,599,3.8,199
https://www.amazon.in/Wesley-Milestone-Waterproof-Backpack-Business/dp/B07K8KLB3P/ref=sr_1_45?crid=2M096C61O4MLT&keywords=bags&qid=1692794785&sprefix=ba%2Caps%2C283&sr=8-45,"Wesley Unisex Milestone Casual Waterproof Laptop Office School College Business Travel Backpack 25 L (Dimensions: 12.5x18 inches) (Compatible with 15.6 inch laptops), Navy Blue",399,4.3,"13,279"
https://www.amazon.in/ADISA-Laptop-Backpack-Office-College/dp/B0BPVLXD53/ref=sr_1_46?crid=2M096C61O4MLT&keywords=bags&qid=1692794785&sprefix=ba%2Caps%2C283&sr=8-46,ADISA 32L large laptop backpack office bag college travel back pack with rain cover,599,3.9,322
https://www.amazon.in/Safari-Spartan-Water-Resistant-Backpack/dp/B09B26MB5M/ref=sr_1_47?crid=2M096C61O4MLT&keywords=bags&qid=1692794785&sprefix=ba%2Caps%2C283&sr=8-47,"Safari Spartan 21 Ltrs Water Resistant Backpack - Blue, S (SPARTAN19CBBLU)",609,3.8,975
https://www.amazon.in/Safari-Laptop-Backpack-Resistant-Fabric/dp/B09B28TKLG/ref=sr_1_48?crid=2M096C61O4MLT&keywords=bags&qid=1692794785&sprefix=ba%2Caps%2C283&sr=8-48,Safari Quill Large Laptop Backpack 26 Ltrs Water Resistant Fabric - Blue,859,4.0,780
https://www.amazon.in/ADISA-Casual-Backpack-College-BP046-NAV_Navy/dp/B0BX3QFVSM/ref=sr_1_49?crid=2M096C61O4MLT&keywords=bags&qid=1692794785&sprefix=ba%2Caps%2C283&sr=8-49,ADISA 31 Ltrs Casual Backpack School College Bag Pack,399,3.9,209
https://www.amazon.in/Kleider-Travel-Business-Messenger-Shoulder/dp/B084ZHP97M/ref=sr_1_50?crid=2M096C61O4MLT&keywords=bags&qid=1692794785&sprefix=ba%2Caps%2C283&sr=8-50,DEIN KLEIDER Men's Nylon Messenger Bag,349,4.0,"5,291"
https://www.amazon.in/Tabelito%C2%AE-Basic-Laptop-Sleeve-Surfacepro/dp/B09NDTW8SP/ref=sr_1_51?crid=2M096C61O4MLT&keywords=bags&qid=1692794785&sprefix=ba%2Caps%2C283&sr=8-51,Tabelito® Basic Laptop Bag Laptop Cover Laptop Bags Laptop Sleeve Office Bag Laptop Bag 15.6 inch(39.6cm) Laptop Apple/Lenovo/Asus/Hp/MacBook/Thinkpad/Ideapad (Grey),299,4.1,"2,403"
https://www.amazon.in/Half-Moon-Resistant-Backpack-Compartment/dp/B0BJ32LQ6X/ref=sr_1_52?crid=2M096C61O4MLT&keywords=bags&qid=1692794785&sprefix=ba%2Caps%2C283&sr=8-52,Half Moon Large 37L Laptop Bag Backpack for menं Women Boys and Girls Luggage Travel Bags with 17.3 inches Laptop Compartment & Rain Cover,849,3.9,"3,459"
https://www.amazon.in/sspa/click?ie=UTF8&spc=MTo2NjA0ODE4MzgwOTg1OTk6MTY5Mjc5NDc4NTpzcF9idGY6MjAxNjQ2ODY4Njg1OTg6OjA6Og&url=%2FSPENZ-BAGS-Backpack-Raincover-Baby-Pink%2Fdp%2FB0C3RNFHHV%2Fref%3Dsr_1_53_sspa%3Fcrid%3D2M096C61O4MLT%26keywords%3Dbags%26qid%3D1692794785%26sprefix%3Dba%252Caps%252C283%26sr%3D8-53-spons%26sp_csd%3Dd2lkZ2V0TmFtZT1zcF9idGY%26psc%3D1,"SPENZ BAGS Travel Laptop Backpack for Women & Men|Carry On Bag, College & School Students Bookbag With Raincover",845,4.0,163
https://www.amazon.in/sspa/click?ie=UTF8&spc=MTo2NjA0ODE4MzgwOTg1OTk6MTY5Mjc5NDc4NTpzcF9idGY6MjAxMDg0NzUwNzQ2OTg6OjA6Og&url=%2Fuppercase-Professional-Backpack-resistant-sustainable%2Fdp%2FB0BRMWDNZ7%2Fref%3Dsr_1_54_sspa%3Fcrid%3D2M096C61O4MLT%26keywords%3Dbags%26qid%3D1692794785%26sprefix%3Dba%252Caps%252C283%26sr%3D8-54-spons%26sp_csd%3Dd2lkZ2V0TmFtZT1zcF9idGY%26psc%3D1,"uppercase 26 Ltrs Ryder Professional Laptop Backpack (15.6 Inch) 3x more water resistant sustainable bags with rain proof zippers for Men, Women, Boys and Girls, 750 Days warranty","2,400",4.3,78
https://www.amazon.in/sspa/click?ie=UTF8&spc=MTo0MjQ0NjYxNzA3ODA3NTk5OjE2OTI3OTQ3ODg6c3BfYXRmX25leHQ6MzAwMDA1OTE3OTA4OTMyOjowOjo&url=%2Fuppercase-Backpack-1800EBP2-resistant-sustainable%2Fdp%2FB0BQYJ8WP5%2Fref%3Dsr_1_49_sspa%3Fcrid%3D2M096C61O4MLT%26keywords%3Dbags%26qid%3D1692794788%26sprefix%3Dba%252Caps%252C283%26sr%3D8-49-spons%26sp_csd%3Dd2lkZ2V0TmFtZT1zcF9hdGZfbmV4dA%26psc%3D1,"uppercase Laptop Backpack Printed Compact 3x more water repellent sustainable bags with rain proof zippers for Men, Women, Boys & Girls, 750 Days warranty (Blue)","1,350",4.1,102
https://www.amazon.in/sspa/click?ie=UTF8&spc=MTo0MjQ0NjYxNzA3ODA3NTk5OjE2OTI3OTQ3ODg6c3BfYXRmX25leHQ6MjAwODE0MzUwODQxOTg6OjA6Og&url=%2Fuppercase-Medium-Laptop-Backpack-2100EBP1%2Fdp%2FB0B5NBLGBQ%2Fref%3Dsr_1_50_sspa%3Fcrid%3D2M096C61O4MLT%26keywords%3Dbags%26qid%3D1692794788%26sprefix%3Dba%252Caps%252C283%26sr%3D8-50-spons%26sp_csd%3Dd2lkZ2V0TmFtZT1zcF9hdGZfbmV4dA%26psc%3D1,uppercase 14 Ltrs Medium (14.6 Inch) Laptop Backpack 2100EBP1 Roll Top Office College 3x More Water Repellent Sustainable Bags With Rainproof Zippers For Unisex,"1,350",4.2,180
https://www.amazon.in/Police-Polyester-laptop-casual-backpack/dp/B09CQ5T3LN/ref=sr_1_51?crid=2M096C61O4MLT&keywords=bags&qid=1692794788&sprefix=ba%2Caps%2C283&sr=8-51,POLICE Backpack for Men Casual Laptop Bag Office/Travel/College 30 Ltr Hedge Polyester - Black,"1,399",4.1,"5,864"
https://www.amazon.in/AUXTER-BLACKY-Duffel-Emboss-Black/dp/B07F2H25NP/ref=sr_1_52?crid=2M096C61O4MLT&keywords=bags&qid=1692794788&sprefix=ba%2Caps%2C283&sr=8-52,AUXTER Faux Leather 23 Cms Duffle Bag(AUX_GB_LE_Black -SE__0521_Black),429,4.3,"9,301"
https://www.amazon.in/Lunars-Comet-Resistant-Casual-Backpack/dp/B07WN833M7/ref=sr_1_53?crid=2M096C61O4MLT&keywords=bags&qid=1692794788&sprefix=ba%2Caps%2C283&sr=8-53,Lunar's Comet 35L Water Resistant Travel Bagpack/College Backpack/School Bag/Office Bag/Business Backpack/Daypack for Men and Women with 1 Year Warranty,778,4.0,"13,654"
https://www.amazon.in/Skybags-Unisex-Gucci-Fabric-Backpacks/dp/B0B21XCFRM/ref=sr_1_54?crid=2M096C61O4MLT&keywords=bags&qid=1692794788&sprefix=ba%2Caps%2C283&sr=8-54,Skybags Unisex Gucci Fabric Backpacks,809,3.9,407
