https://www.amazon.in/sspa/click?ie=UTF8&spc=MTo3OTU3MjA4OTUzMjc2NTk5OjE2OTI3OTQ3OTg6c3BfYnRmOjIwMDk3NjEyMjMwNzk4OjowOjo&url=%2Fuppercase-Backpack-1600EBP1-resistant-sustainable%2Fdp%2FB0B68ZS5G1%2Fref%3Dsr_1_117_sspa%3Fcrid%3D2M096C61O4MLT%26keywords%3Dbags%26qid%3D1692794798%26sprefix%3Dba%252Caps%252C283%26sr%3D8-117-spons%26sp_csd%3Dd2lkZ2V0TmFtZT1zcF9idGY%26psc%3D1,"uppercase Laptop Backpack 1600EBP Compact 3x more water repellent sustainable bags with rain proof zippers for Men, Women, Boys and Girls, 750 Days warranty",950,4.0,236
https://www.amazon.in/sspa/click?ie=UTF8&spc=MTo3OTU3MjA4OTUzMjc2NTk5OjE2OTI3OTQ3OTg6c3BfYnRmOjIwMTQ1MzU3MTAyMjk4OjowOjo&url=%2Fuppercase-Professional-Anti-theft-resistant-sustainable%2Fdp%2FB0C1CBY2PJ%2Fref%3Dsr_1_118_sspa%3Fcrid%3D2M096C61O4MLT%26keywords%3Dbags%26qid%3D1692794798%26sprefix%3Dba%252Caps%252C283%26sr%3D8-118-spons%26sp_csd%3Dd2lkZ2V0TmFtZT1zcF9idGY%26psc%3D1,"uppercase Matrix Professional Anti-theft Laptop Backpack (15.6 Inch) 3x more water resistant sustainable bags with rain proof zippers for Men, Women, Boys and Girls, 750 Days warranty","2,300",4.2,63
https://www.amazon.in/sspa/click?ie=UTF8&spc=MToyNjc4OTczMDY4MTc1OTk6MTY5Mjc5NDgwMjpzcF9hdGZfbmV4dDozMDAwMDI1OTUxNDYzMzI6OjA6Og&url=%2Fuppercase-Professional-Anti-Theft-Overnighter-sustainable%2Fdp%2FB0C7CQ1MVD%2Fref%3Dsr_1_113_sspa%3Fcrid%3D2M096C61O4MLT%26keywords%3Dbags%26qid%3D1692794802%26sprefix%3Dba%252Caps%252C283%26sr%3D8-113-spons%26sp_csd%3Dd2lkZ2V0TmFtZT1zcF9hdGZfbmV4dA%26psc%3D1,uppercase Nexus Professional Anti-Theft Overnighter Travel Laptop Backpack,"2,500",4.9,11
https://www.amazon.in/Red-Lemon-Backpack-Accessories-Organiser/dp/B0C2KRH268/ref=sr_1_115?crid=2M096C61O4MLT&keywords=bags&qid=1692794802&sprefix=ba%2Caps%2C283&sr=8-115,"Red Lemon Swiss Cut Design 15.6 Inch Smart Laptop Backpack Bag With USB Charging Port, Anti Theft Pocket and Accessories Organiser for Men Women Boys Girls","1,799",4.4,"1,149"
https://www.amazon.in/Dyazo-Resistant-Photographers-Compatible-Panasonic/dp/B0BWWD1QQQ/ref=sr_1_116?crid=2M096C61O4MLT&keywords=bags&qid=1692794802&sprefix=ba%2Caps%2C283&sr=8-116,Dyazo Water Resistant Camera Backpack with Extra Front Pocket Photographers Bag with Rain Cover Tripod Holder Compatible for Sony Nikon Canon Panasonic DSLR (Black & Orange),799,4.3,525
https://www.amazon.in/Lenovo-Carrying-15-6-Inch-Toploader-GX40Q17229/dp/B075Y6Y9H5/ref=sr_1_117?crid=2M096C61O4MLT&keywords=bags&qid=1692794802&sprefix=ba%2Caps%2C283&sr=8-117,Lenovo 15.6-inch Casual Laptop Briefcase T210,799,4.2,"20,873"
https://www.amazon.in/NORTH-ZONE-Lightweight-Backpacks-Stylish/dp/B0BL3S5NC1/ref=sr_1_118?crid=2M096C61O4MLT&keywords=bags&qid=1692794802&sprefix=ba%2Caps%2C283&sr=8-118,NORTH ZONE Lightweight school bags Backpacks for Boys Girls Stylish men and women Casual Travel Laptop Bag College office,630,4.0,938
https://www.amazon.in/FALONG-Resistant-Sweat-Proof-Adjustable-Headphone/dp/B0C9HRR6NW/ref=sr_1_119?crid=2M096C61O4MLT&keywords=bags&qid=1692794802&sprefix=ba%2Caps%2C283&sr=8-119,"FALONG Waist Bag for Men & Women Water Resistant Running Waist Pack, Running Belt with Large Capacity, Sweat-Proof Adjustable Elastic Strap and Headphone Hole, Ideal for All Mobile Phones",320,4.7,8
https://www.amazon.in/Half-Moon-Spacious-Backpack-Compartment/dp/B0C23BYDML/ref=sr_1_120?crid=2M096C61O4MLT&keywords=bags&qid=1692794802&sprefix=ba%2Caps%2C283&sr=8-120,Half Moon Strike 35L Unisex Spacious School/Laptop/College/Office Travel Backpack Bag for Men Women Boys & Girls with 15.6 inch Padded Laptop Compartment & Multiple Pockets,699,3.6,29
https://www.amazon.in/Mokobara-Transit-Backpack-Laptop-Sunray/dp/B09V7R98XC/ref=sr_1_121?crid=2M096C61O4MLT&keywords=bags&qid=1692794802&sprefix=ba%2Caps%2C283&sr=8-121,"MOKOBARA The Transit Backpack - 30L Premium Nylon 15.6"" Unisex Laptop Bag With Luggage Sleeve","4,999",4.5,655
https://www.amazon.in/Hoteon-Backpack-Anti-Theft-Earphone-Resistant/dp/B08HM4TQZZ/ref=sr_1_122?crid=2M096C61O4MLT&keywords=bags&qid=1692794802&sprefix=ba%2Caps%2C283&sr=8-122,"Golden Wolf Laptop Bag Anti-theft Backpack with Lock College School Laptop Backpack with Rain Cover Water Resistant Business Backpack with USB Port for 15.6-inch Laptop Office Travel Bag for Men and Women Gifts, Dark Grey","1,999",4.4,"3,503"
https://www.amazon.in/sspa/click?ie=UTF8&spc=MToyNjc4OTczMDY4MTc1OTk6MTY5Mjc5NDgwMjpzcF9tdGY6MjAwNjE2MDkyNTQyOTg6OjA6Og&url=%2FSafari-Overnighter-Resistant-Travelling-All-Purpose%2Fdp%2FB097JM98M1%2Fref%3Dsr_1_123_sspa%3Fcrid%3D2M096C61O4MLT%26keywords%3Dbags%26qid%3D1692794802%26sprefix%3Dba%252Caps%252C283%26sr%3D8-123-spons%26sp_csd%3Dd2lkZ2V0TmFtZT1zcF9tdGY%26psc%3D1,"Safari Seek 32 Ltrs Overnighter Travel Laptop Backpack (Blue), Water Resistant Spacious Bag for Travelling and Camping, All-Purpose Bag for Business & Leisure","1,959",4.3,186
https://www.amazon.in/sspa/click?ie=UTF8&spc=MToyNjc4OTczMDY4MTc1OTk6MTY5Mjc5NDgwMjpzcF9tdGY6MzAwMDM3Nzc4NDQ0NzMyOjowOjo&url=%2Fnano17-Waterproof-Backpack-College-Business%2Fdp%2FB0BQ6ZPLFK%2Fref%3Dsr_1_124_sspa%3Fcrid%3D2M096C61O4MLT%26keywords%3Dbags%26qid%3D1692794802%26sprefix%3Dba%252Caps%252C283%26sr%3D8-124-spons%26sp_csd%3Dd2lkZ2V0TmFtZT1zcF9tdGY%26psc%3D1,BORA Bag nano17 Waterproof Laptop Backpack/Office Bag/School Bag/College Bag/Business Bag/Travel Blue Yellow Casual Utility Backpack (Leather Edition),459,4.1,9
https://www.amazon.in/Fast-Travel-partition-Collage-Backpack/dp/B09XLK25VC/ref=sr_1_125?crid=2M096C61O4MLT&keywords=bags&qid=1692794802&sprefix=ba%2Caps%2C283&sr=8-125,Fast Travel School Bag Class 5-10 Large 4 partition 45 L Laptop Collage Office Travel Backpack Unisex,620,4.0,"1,132"
https://www.amazon.in/Trajectory-Elegant-15-6-Laptop-Office/dp/B09RK6NCGC/ref=sr_1_126?crid=2M096C61O4MLT&keywords=bags&qid=1692794802&sprefix=ba%2Caps%2C283&sr=8-126,Trajectory 15.6 Inch Vegan Leather Messenger Laptop bag for men in Office for all laptop like Apple MacBook with 2 Years Warranty and Spacious Multiple Compartment with Expandable Bottom Used as Shoulder and Handbag for Men,"1,399",4.1,502
https://www.amazon.in/FUR-JADEN-Backpack-Compartment-Organizer/dp/B0BYSZ3TKW/ref=sr_1_127?crid=2M096C61O4MLT&keywords=bags&qid=1692794802&sprefix=ba%2Caps%2C283&sr=8-127,"FUR JADEN Anti Theft Number Lock Backpack Bag with 15.6 Inch Laptop Compartment, USB Charging Port & Organizer Pocket for Men Women Boys Girls",799,4.3,122
https://www.amazon.in/Waterproof-Laptop-College-Backpack-Navy_Blue/dp/B0BW9BTJCZ/ref=sr_1_128?crid=2M096C61O4MLT&keywords=bags&qid=1692794802&sprefix=ba%2Caps%2C283&sr=8-128,30 L Waterproof Laptop/College/School/Office Bag Backpack for Men Women Boys Girls with Rain Cover (Navy_Blue),486,3.4,9
https://www.amazon.in/Nivia-Beast-Gym-Green-Grey/dp/B078PJH887/ref=sr_1_129?crid=2M096C61O4MLT&keywords=bags&qid=1692794802&sprefix=ba%2Caps%2C283&sr=8-129,NIVIA Beast Gym Bag-4 Polyester/Unisex Gym Bags/Shoulder Bag for Men & Women with Separate Shoes Compartment/Carry Gym Accessories/Fitness Bag/Sports & Travel Bag/Sports Kit,620,4.2,"3,506"
https://www.amazon.in/HP-Lightweight-200-Green-Backpack/dp/B08CY1XYFL/ref=sr_1_130?crid=2M096C61O4MLT&keywords=bags&qid=1692794802&sprefix=ba%2Caps%2C283&sr=8-130,"HP Lightweight 200 15.6-inch Laptop Backpack with Padded Shoulder Straps, Green","1,499",4.3,278
https://www.amazon.in/BennettTM-Shoulder-Messenger-Repellent-Charcoal/dp/B09CV24TMK/ref=sr_1_131?crid=2M096C61O4MLT&keywords=bags&qid=1692794802&sprefix=ba%2Caps%2C283&sr=8-131,Bennett™ Mystic Unisex Adult Men's Laptop Bag 15.6 inch Side Shoulder Briefcase Satchel Messenger Business Bags for Men & Women Front Pocket for Laptop Accessories - Black (6 Month Warranty),512,4.0,"6,468"
https://www.amazon.in/Inovera-Label-Women-Handbags-Shoulder/dp/B08CMQD4BC/ref=sr_1_132?crid=2M096C61O4MLT&keywords=bags&qid=1692794802&sprefix=ba%2Caps%2C283&sr=8-132,INOVERA (LABEL) Women Handbags Shoulder Hobo Bag Purse With Long Strap,"1,299",4.1,"8,543"
https://www.amazon.in/sspa/click?ie=UTF8&spc=MToyNjc4OTczMDY4MTc1OTk6MTY5Mjc5NDgwMjpzcF9idGY6MjAxNTU5NDA4NDE1OTg6OjA6Og&url=%2FTabelito-NEO-Backpack-Business-Compartment%2Fdp%2FB0C2D2XC4H%2Fref%3Dsr_1_133_sspa%3Fcrid%3D2M096C61O4MLT%26keywords%3Dbags%26qid%3D1692794802%26sprefix%3Dba%252Caps%252C283%26sr%3D8-133-spons%26sp_csd%3Dd2lkZ2V0TmFtZT1zcF9idGY%26psc%3D1,"Tabelito® NEO 3O L Water Resistant Laptop/College/Office/School/Travel/Business Bag, Unisex Backpack for Men Women Fits Up to 15.6 Inch Laptop Notebook.",399,4.0,191
https://www.amazon.in/sspa/click?ie=UTF8&spc=MToyNjc4OTczMDY4MTc1OTk6MTY5Mjc5NDgwMjpzcF9idGY6MjAwNjE2MDkyNTQzOTg6OjA6Og&url=%2FSafari-Overnighter-Resistant-Polyester-Travelling%2Fdp%2FB097JK3X9D%2Fref%3Dsr_1_134_sspa%3Fcrid%3D2M096C61O4MLT%26keywords%3Dbags%26qid%3D1692794802%26sprefix%3Dba%252Caps%252C283%26sr%3D8-134-spons%26sp_csd%3Dd2lkZ2V0TmFtZT1zcF9idGY%26psc%3D1,"Safari Crew Overnighter Backpack, 40 Ltr Water Resistant Travel Laptop Bag, Black Polyester Backpack for Men and Women, Spacious Shoulder Bag for Travelling and Camping","1,709",4.3,263
https://www.amazon.in/sspa/click?ie=UTF8&spc=MTo1MTc1MjA5MTczMDg1NTk5OjE2OTI3OTQ4MDU6c3BfYXRmX25leHQ6MjAwNjk1MDQ4MTkyOTg6OjA6Og&url=%2Fuppercase-Overnighter-Backpack-Repellent-Sustainable%2Fdp%2FB0B8NXYFXL%2Fref%3Dsr_1_129_sspa%3Fcrid%3D2M096C61O4MLT%26keywords%3Dbags%26qid%3D1692794805%26sprefix%3Dba%252Caps%252C283%26sr%3D8-129-spons%26sp_csd%3Dd2lkZ2V0TmFtZT1zcF9hdGZfbmV4dA%26psc%3D1,"uppercase Medium 21 Ltrs Office Overnighter (14.6 inch) Laptop Backpack 2700EBP1 3x More Water Repellent Sustainable Bags with Rain Proof Zippers, Black","1,800",4.2,35
https://www.amazon.in/sspa/click?ie=UTF8&spc=MTo1MTc1MjA5MTczMDg1NTk5OjE2OTI3OTQ4MDU6c3BfYXRmX25leHQ6MjAxMDU0NTE4NTE0OTg6OjA6Og&url=%2Fuppercase-Professional-resistant-sustainable-Anti-theft%2Fdp%2FB0BR179L65%2Fref%3Dsr_1_130_sspa%3Fcrid%3D2M096C61O4MLT%26keywords%3Dbags%26qid%3D1692794805%26sprefix%3Dba%252Caps%252C283%26sr%3D8-130-spons%26sp_csd%3Dd2lkZ2V0TmFtZT1zcF9hdGZfbmV4dA%26psc%3D1,"uppercase SealPro Professional Laptop Backpack (15.6 Inch) 3x more water resistant sustainable bags with rain proof zippers & Anti-theft for Men, Women, Boys and Girls, 750 Days warranty","1,900",4.5,78
https://www.amazon.in/Waterproof-Laptop-College-Backpack-Navy_Blue/dp/B0BW9BTJCZ/ref=sr_1_131?crid=2M096C61O4MLT&keywords=bags&qid=1692794805&sprefix=ba%2Caps%2C283&sr=8-131,30 L Waterproof Laptop/College/School/Office Bag Backpack for Men Women Boys Girls with Rain Cover (Navy_Blue),486,3.4,9
https://www.amazon.in/POLESTAR-backpack-Backpack-College-Students/dp/B08X2JSJ6N/ref=sr_1_132?crid=2M096C61O4MLT&keywords=bags&qid=1692794805&sprefix=ba%2Caps%2C283&sr=8-132,"POLESTAR Leader 34 L Bag for College, School, Office, Casual Multipurpose Backpack with 15.6"" Laptop Compartment, Water Resistant, Unisex Design, Stylish & Durable, 1 Year Warranty",639,4.1,"3,544"
https://www.amazon.in/Half-Moon-Laptop-Bag-Compartment/dp/B0C1NZLF67/ref=sr_1_133?crid=2M096C61O4MLT&keywords=bags&qid=1692794805&sprefix=ba%2Caps%2C283&sr=8-133,Half Moon Valex Unisex School Bag/ 15.6 inch Laptop Backpack/College Bagpack/Office Back Packed | Laptop Bag for Men & Women | School Bags for Boys & Girls with Small Pockets & Laptop Compartment,649,3.7,94
https://www.amazon.in/Nivia-Beast-Gym-Green-Grey/dp/B078PJH887/ref=sr_1_134?crid=2M096C61O4MLT&keywords=bags&qid=1692794805&sprefix=ba%2Caps%2C283&sr=8-134,NIVIA Beast Gym Bag-4 Polyester/Unisex Gym Bags/Shoulder Bag for Men & Women with Separate Shoes Compartment/Carry Gym Accessories/Fitness Bag/Sports & Travel Bag/Sports Kit,620,4.2,"3,506"
https://www.amazon.in/Gear-Vintage2-Leather-Backpack-LBPVG2LTH1901/dp/B07G4F3758/ref=sr_1_135?crid=2M096C61O4MLT&keywords=bags&qid=1692794805&sprefix=ba%2Caps%2C283&sr=8-135,Gear Vintage2 Anti Theft Faux Leather 18 cms Tan Laptop Backpack,979,4.3,"1,698"
https://www.amazon.in/BennettTM-Shoulder-Messenger-Repellent-Charcoal/dp/B09CV24TMK/ref=sr_1_136?crid=2M096C61O4MLT&keywords=bags&qid=1692794805&sprefix=ba%2Caps%2C283&sr=8-136,Bennett™ Mystic Unisex Adult Men's Laptop Bag 15.6 inch Side Shoulder Briefcase Satchel Messenger Business Bags for Men & Women Front Pocket for Laptop Accessories - Black (6 Month Warranty),512,4.0,"6,468"
https://www.amazon.in/Gear-Superior-Casual-Backpack-BKPSPRIOR0001/dp/B08GY2ZN96/ref=sr_1_137?crid=2M096C61O4MLT&keywords=bags&qid=1692794805&sprefix=ba%2Caps%2C283&sr=8-137,Gear Superior 16LWater Resistant School Bag//Backpack/College Bag for Men/Women - Black,350,4.0,333
https://www.amazon.in/Amazon-Basics-Laptop-Backpack-Repellent/dp/B09W43XLBY/ref=sr_1_138?crid=2M096C61O4MLT&keywords=bags&qid=1692794805&sprefix=ba%2Caps%2C283&sr=8-138,"Amazon Basics Water Repellent and Wear Resistant Laptop Backpack - 24L, Blue",649,4.2,513
https://www.amazon.in/sspa/click?ie=UTF8&spc=MTo1MTc1MjA5MTczMDg1NTk5OjE2OTI3OTQ4MDU6c3BfbXRmOjIwMTAzNDY3NjkyMTk4OjowOjo&url=%2FSwiss-Military-Camouflage-Adjustable-LBP96%2Fdp%2FB0BBLZ2KT8%2Fref%3Dsr_1_139_sspa%3Fcrid%3D2M096C61O4MLT%26keywords%3Dbags%26qid%3D1692794805%26sprefix%3Dba%252Caps%252C283%26sr%3D8-139-spons%26sp_csd%3Dd2lkZ2V0TmFtZT1zcF9tdGY%26psc%3D1%26smid%3DA9XP90DC1X0F8,"Swiss Military laptop Bag, Camouflage Print Multi Utility Backpack, Polyester, Adjustable Strap, USB Charging Socket (LBP96)","1,202",3.3,5
https://www.amazon.in/sspa/click?ie=UTF8&spc=MTo1MTc1MjA5MTczMDg1NTk5OjE2OTI3OTQ4MDU6c3BfbXRmOjIwMTUyNzQwNjAwMzk4OjowOjo&url=%2FRed-Lemon-Stylish-Backpack-Charging%2Fdp%2FB09WYVNW46%2Fref%3Dsr_1_140_sspa%3Fcrid%3D2M096C61O4MLT%26keywords%3Dbags%26qid%3D1692794805%26sprefix%3Dba%252Caps%252C283%26sr%3D8-140-spons%26sp_csd%3Dd2lkZ2V0TmFtZT1zcF9tdGY%26psc%3D1,Red Lemon Arctic Hunter Stylish Men Bag Fit in 15.6 inch Laptop Backpack Usb Charging Port Travel Bagpack,"2,299",4.1,93
https://www.amazon.in/Martucci-Waterproof-Backpack-College-Business/dp/B0B1HM2ZGX/ref=sr_1_141?crid=2M096C61O4MLT&keywords=bags&qid=1692794805&sprefix=ba%2Caps%2C283&sr=8-141,Martucci 16 inch 36L Casual Waterproof Backpack/Office Bag/School Bag/College Bag/Business Bag/Unisex Travel Backpack,599,3.8,199
https://www.amazon.in/Gear-DOUBLE-Resistant-Backpack-Navy-Tan/dp/B0BTJ2T26W/ref=sr_1_142?crid=2M096C61O4MLT&keywords=bags&qid=1692794805&sprefix=ba%2Caps%2C283&sr=8-142,Gear DOUBLE DECKER 31L Water Resistant Laptop Bag/Backpack/Office Bag for Men/Women (Navy-Tan),"1,019",3.5,25
https://www.amazon.in/Nivia-Pulse-Junior-Bag-Aqua-Green/dp/B08D7QNYZX/ref=sr_1_143?crid=2M096C61O4MLT&keywords=bags&qid=1692794805&sprefix=ba%2Caps%2C283&sr=8-143,"Nivia 5227 Pulse Junior Bag, Others (Orange) (Aqua/Green)",294,3.7,251
https://www.amazon.in/Genie-Heartbeat-compartments-Lightweight-Travelling/dp/B097JJFF6Z/ref=sr_1_144?crid=2M096C61O4MLT&keywords=bags&qid=1692794805&sprefix=ba%2Caps%2C283&sr=8-144,"Genie Heartbeat Backpack for Women 3 compartments, School Bags for Girls, Stylish and Trendy College Backpacks for Girls, Water Resistant and Lightweight Bags for Office and Travelling Purpose.",753,4.4,298
https://www.amazon.in/Waterproof-Backpack-College-Business-Dimensions/dp/B0BW95MXRJ/ref=sr_1_145?crid=2M096C61O4MLT&keywords=bags&qid=1692794805&sprefix=ba%2Caps%2C283&sr=8-145,NORTH ZONE Casual Waterproof Laptop Backpack/Office Bag/School Bag/College Bag/Business Bag/Travel Backpack (Dimensions:13x18 inches) (Compatible with 39.62cm(15.6inch laptop) 30 L (Blue & black),486,4.6,3
https://www.amazon.in/Inovera-Label-Women-Handbags-Shoulder/dp/B08CMQD4BC/ref=sr_1_146?crid=2M096C61O4MLT&keywords=bags&qid=1692794805&sprefix=ba%2Caps%2C283&sr=8-146,INOVERA (LABEL) Women Handbags Shoulder Hobo Bag Purse With Long Strap,"1,299",4.1,"8,543"
https://www.amazon.in/HP-Essentials-Polyester-Laptop-Backpack/dp/B07GGS4RDV/ref=sr_1_147?crid=2M096C61O4MLT&keywords=bags&qid=1692794805&sprefix=ba%2Caps%2C283&sr=8-147,"HP Essentials Polyester Black, Grey Laptop Backpack","1,199",4.1,299
https://www.amazon.in/F-Gear-Spartan-Black-Laptop-Backpack/dp/B07X82WYGL/ref=sr_1_148?crid=2M096C61O4MLT&keywords=bags&qid=1692794805&sprefix=ba%2Caps%2C283&sr=8-148,F Gear Spartan 24 Ltrs Black Laptop Backpack (3179),623,4.0,110
https://www.amazon.in/sspa/click?ie=UTF8&spc=MTo1MTc1MjA5MTczMDg1NTk5OjE2OTI3OTQ4MDU6c3BfYnRmOjIwMTQzMjMwMzgxOTk4OjowOjo&url=%2FTabelito-Laptop-Backpack-15-6-inch-Repellent%2Fdp%2FB08Y3L4PHK%2Fref%3Dsr_1_149_sspa%3Fcrid%3D2M096C61O4MLT%26keywords%3Dbags%26qid%3D1692794805%26sprefix%3Dba%252Caps%252C283%26sr%3D8-149-spons%26sp_csd%3Dd2lkZ2V0TmFtZT1zcF9idGY%26psc%3D1,"TABELITO Casual Laptop Backpack 15.6-inch, 25 LTR Water Repellent",548,4.2,423
https://www.amazon.in/sspa/click?ie=UTF8&spc=MTo1MTc1MjA5MTczMDg1NTk5OjE2OTI3OTQ4MDU6c3BfYnRmOjIwMDk3NjEyMjMxODk4OjowOjo&url=%2Fuppercase-resistant-sustainable-Rainproof-Detachable%2Fdp%2FB0BC48NDJP%2Fref%3Dsr_1_150_sspa%3Fcrid%3D2M096C61O4MLT%26keywords%3Dbags%26qid%3D1692794805%26sprefix%3Dba%252Caps%252C283%26sr%3D8-150-spons%26sp_csd%3Dd2lkZ2V0TmFtZT1zcF9idGY%26psc%3D1,"uppercase 22 Ltrs Large (14.6 inch) Laptop Backpack 2900EBP1 Bucket Outdoor 3x more water repellent sustainable bag with Rainproof zipper & Detachable organizer for Men, Women, Boys and Girls , 750 Days warranty","1,600",4.5,32
https://www.amazon.in/sspa/click?ie=UTF8&spc=MTo3NjM3MDgwODQ3MzU0NTk5OjE2OTI3OTQ4MDk6c3BfYXRmX25leHQ6MzAwMDA4MDIwNTg5NzMyOjowOjo&url=%2FAristocrat-Space-Unisex-Wine-Laptop%2Fdp%2FB0B5YGJQSV%2Fref%3Dsr_1_145_sspa%3Fcrid%3D2M096C61O4MLT%26keywords%3Dbags%26qid%3D1692794809%26sprefix%3Dba%252Caps%252C283%26sr%3D8-145-spons%26sp_csd%3Dd2lkZ2V0TmFtZT1zcF9hdGZfbmV4dA%26psc%3D1,Aristocrat Hi Space 40L Unisex Wine Laptop Bags,"1,051",4.1,11
https://www.amazon.in/sspa/click?ie=UTF8&spc=MTo3NjM3MDgwODQ3MzU0NTk5OjE2OTI3OTQ4MDk6c3BfYXRmX25leHQ6MzAwMDM4NTM0NDE2MjMyOjowOjo&url=%2FImpulse-Seacon-Backpack-Business-Resistant%2Fdp%2FB0C1CS9HKH%2Fref%3Dsr_1_146_sspa%3Fcrid%3D2M096C61O4MLT%26keywords%3Dbags%26qid%3D1692794809%26sprefix%3Dba%252Caps%252C283%26sr%3D8-146-spons%26sp_csd%3Dd2lkZ2V0TmFtZT1zcF9hdGZfbmV4dA%26psc%3D1,Impulse Seacon 40L Laptop Backpack/Office Bag/School Bag/College Bag/Business Bag/Travel Backpack Water Resistant Fits Up to 16 Inch Laptop with 1 Year Warranty,"1,517",3.6,7
https://www.amazon.in/HP-Essentials-Polyester-Laptop-Backpack/dp/B07GGS4RDV/ref=sr_1_147?crid=2M096C61O4MLT&keywords=bags&qid=1692794809&sprefix=ba%2Caps%2C283&sr=8-147,"HP Essentials Polyester Black, Grey Laptop Backpack","1,199",4.1,299
https://www.amazon.in/TRUE-HUMAN-Anti-Theft-charging-combination/dp/B09H7PK5ML/ref=sr_1_148?crid=2M096C61O4MLT&keywords=bags&qid=1692794809&sprefix=ba%2Caps%2C283&sr=8-148,TRUE HUMAN Anti-Theft and USB charging port backpack with security lock Laptop bag|office bag| for men and women (Grey),649,3.8,"1,910"
https://www.amazon.in/F-Gear-Spartan-Black-Laptop-Backpack/dp/B07X82WYGL/ref=sr_1_149?crid=2M096C61O4MLT&keywords=bags&qid=1692794809&sprefix=ba%2Caps%2C283&sr=8-149,F Gear Spartan 24 Ltrs Black Laptop Backpack (3179),623,4.0,110
https://www.amazon.in/Safari-Polyester-Cms-Travel-KRYPTON17DFBLU_Blue/dp/B097L2RSF1/ref=sr_1_150?crid=2M096C61O4MLT&keywords=bags&qid=1692794809&sprefix=ba%2Caps%2C283&sr=8-150,Safari Polyester 24 Cms Travel Bag(KRYPTON17DFBLU_Blue),517,3.7,72
https://www.amazon.in/SFANE-Polyester-Shoulder-Separate-Compartment/dp/B08KG7J7L5/ref=sr_1_151?crid=2M096C61O4MLT&keywords=bags&qid=1692794809&sprefix=ba%2Caps%2C283&sr=8-151,"SFANE Polyester Red Duffel Gym Bag, Shoulder Bag, Sports Bag for Men & Women with Separate Shoe Compartment (Black) (Red) Set Of 1",387,4.3,381
https://www.amazon.in/Gear-Colorado-Orange-Laptop-Backpack/dp/B097K6KD7W/ref=sr_1_152?crid=2M096C61O4MLT&keywords=bags&qid=1692794809&sprefix=ba%2Caps%2C283&sr=8-152,F Gear Colorado Grey Orange 39 Ltrs Laptop Backpack (3814),895,4.2,224
https://www.amazon.in/Fur-Jaden-resistant-Backpack-BM100_Brown/dp/B07P5X6NSN/ref=sr_1_153?crid=2M096C61O4MLT&keywords=bags&qid=1692794809&sprefix=ba%2Caps%2C283&sr=8-153,FUR JADEN Vegan Leather 30L 15.6 Inch Laptop Backpack for Men Women for Office Professionals and College Students,839,4.2,"2,346"
https://www.amazon.in/Kuber-Industries-Avengers-Backpacks-Waterproof/dp/B0BP7JFYDV/ref=sr_1_154?crid=2M096C61O4MLT&keywords=bags&qid=1692794809&sprefix=ba%2Caps%2C283&sr=8-154,Kuber Industries Marvel Avengers School Bag for Kids|Stylish Backpacks for Kids|Rexine Waterproof Shoulder Straps Bag (Blue),664,3.9,75
https://www.amazon.in/sspa/click?ie=UTF8&spc=MTo3NjM3MDgwODQ3MzU0NTk5OjE2OTI3OTQ4MDk6c3BfbXRmOjIwMDYxNjA5MjU0MTk4OjowOjo&url=%2FSafari-Overnighter-Resistant-Travelling-All-Purpose%2Fdp%2FB097JMR4M6%2Fref%3Dsr_1_155_sspa%3Fcrid%3D2M096C61O4MLT%26keywords%3Dbags%26qid%3D1692794809%26sprefix%3Dba%252Caps%252C283%26sr%3D8-155-spons%26sp_csd%3Dd2lkZ2V0TmFtZT1zcF9tdGY%26psc%3D1,"Safari Seek 32 Ltrs Large Overnighter Travel Laptop Backpack, Water Resistant Spacious Bag for Travelling and Camping, All-Purpose Bag for Business & Leisure- Black","2,089",4.4,275
https://www.amazon.in/SPENZ-BAGS-Backpack-Raincover-Baby-Pink/dp/B0C3RNFHHV/ref=sr_1_157?crid=2M096C61O4MLT&keywords=bags&qid=1692794809&sprefix=ba%2Caps%2C283&sr=8-157,"SPENZ BAGS Travel Laptop Backpack for Women & Men|Carry On Bag, College & School Students Bookbag With Raincover",845,4.0,163
https://www.amazon.in/Tabelito-Laptop-Backpack-15-6-inch-Repellent/dp/B08Y5S6C2P/ref=sr_1_158?crid=2M096C61O4MLT&keywords=bags&qid=1692794809&sprefix=ba%2Caps%2C283&sr=8-158,"TABELITO Casual Laptop Backpack 15.6-inch, 25 LTR Water Repellent",548,4.0,689
https://www.amazon.in/Crossbody-Waterproof-Daypack-Charging-Locomotive/dp/B0BCQ762R6/ref=sr_1_159?crid=2M096C61O4MLT&keywords=bags&qid=1692794809&sprefix=ba%2Caps%2C283&sr=8-159,HOXSURY Sling Backpack USB Anti-Theft Waterproof Chest Daypack Casual Shoulder Bag,"1,199",4.4,84
https://www.amazon.in/satellite-backpacks-backpack-school-bagpack/dp/B083DZVFZM/ref=sr_1_160?crid=2M096C61O4MLT&keywords=bags&qid=1692794809&sprefix=ba%2Caps%2C283&sr=8-160,satellite backpacks for men women backpack bags school bag boys under 35 ltr litres casual bagpack black,516,3.8,375
https://www.amazon.in/Skybags-Cardiff-Polyester-Travel-DFTCAR62ERED/dp/B073JSGMRS/ref=sr_1_161?crid=2M096C61O4MLT&keywords=bags&qid=1692794809&sprefix=ba%2Caps%2C283&sr=8-161,Skybags Cardiff Polyester 63.5 Cms Travel Duffle Bag (Red),"1,908",4.2,"5,023"
https://www.amazon.in/DIVULGE-Drawstring-Bag-Sports-Utility/dp/B07PXTDBH4/ref=sr_1_162?crid=2M096C61O4MLT&keywords=bags&qid=1692794809&sprefix=ba%2Caps%2C283&sr=8-162,"DIVULGE Multi Utility Drawstring Bag (Black , 16 L)",145,4.0,"1,159"
https://www.amazon.in/Business-Casual-Resistant-Laptop-Backpack/dp/B0862V2GKH/ref=sr_1_163?crid=2M096C61O4MLT&keywords=bags&qid=1692794809&sprefix=ba%2Caps%2C283&sr=8-163,MI Business Casual 21L Water Resistant Laptop Backpack,999,4.4,"1,392"
https://www.amazon.in/ASTRID-Blue-Diamond-Textured-Cotton/dp/B08W5DQ33D/ref=sr_1_164?crid=2M096C61O4MLT&keywords=bags&qid=1692794809&sprefix=ba%2Caps%2C283&sr=8-164,ASTRID Blue Diamond Textured Cotton Tote Bag,589,4.4,226
https://www.amazon.in/sspa/click?ie=UTF8&spc=MTo3NjM3MDgwODQ3MzU0NTk5OjE2OTI3OTQ4MDk6c3BfYnRmOjIwMDkwNjY0ODg2MDk4OjowOjo&url=%2FXForce-Plaza-Backpack-Interface-Breakers%2Fdp%2FB0BKWX4NMD%2Fref%3Dsr_1_165_sspa%3Fcrid%3D2M096C61O4MLT%26keywords%3Dbags%26qid%3D1692794809%26sprefix%3Dba%252Caps%252C283%26sr%3D8-165-spons%26sp_csd%3Dd2lkZ2V0TmFtZT1zcF9idGY%26psc%3D1,"XForce Plaza Bangtan Boys KPOP Casual Backpack,USB and Audio Cable Interface Breakers Suitable for Students Laptop Backpack","1,299",3.9,22
https://www.amazon.in/sspa/click?ie=UTF8&spc=MTozMDE0NzIxMDc4NjAzNTk5OjE2OTI3OTQ4MTI6c3BfYXRmX25leHQ6MjAxMDIyMjc5MjkzOTg6OjA6Og&url=%2Fuppercase-Backpack-2500EBP2-repellent-sustainable%2Fdp%2FB0BNVXG27V%2Fref%3Dsr_1_162_sspa%3Fcrid%3D2M096C61O4MLT%26keywords%3Dbags%26qid%3D1692794812%26sprefix%3Dba%252Caps%252C283%26sr%3D8-162-spons%26sp_csd%3Dd2lkZ2V0TmFtZT1zcF9hdGZfbmV4dA%26psc%3D1,"uppercase Medium 21L Quilted Laptop Backpack 2500EBP2 3x more water repellent sustainable bags with rain proof zippers for Men, Women, Boys and Girls, 750 Days warranty","1,400",4.6,18
https://www.amazon.in/ZAmaizoomTM-Waterproof-Backpack-Business-Backpack-Free/dp/B08MDDV2VM/ref=sr_1_163?crid=2M096C61O4MLT&keywords=bags&qid=1692794812&sprefix=ba%2Caps%2C283&sr=8-163,"ZAmaizoom Unisex Casual Waterproof Small Size Single Compartment Outdoor Mini Backpack For Gym, College, Drawing Class, Short Tour, Office Tiffin and So Many Purpose (12-15 L, SEA GREEN, SGP2 Model)",249,3.8,"1,104"
https://www.amazon.in/Kuber-Industries-Avengers-Backpacks-Waterproof/dp/B0BP7JFYDV/ref=sr_1_164?crid=2M096C61O4MLT&keywords=bags&qid=1692794812&sprefix=ba%2Caps%2C283&sr=8-164,Kuber Industries Marvel Avengers School Bag for Kids|Stylish Backpacks for Kids|Rexine Waterproof Shoulder Straps Bag (Blue),664,3.9,75
https://www.amazon.in/DZert-Rumble-School-Backpacks-Cartoon/dp/B0994PHBSL/ref=sr_1_165?crid=2M096C61O4MLT&keywords=bags&qid=1692794812&sprefix=ba%2Caps%2C283&sr=8-165,DZert Kids School Bag Soft Plush Backpacks Cartoon Boys Girls Baby (2-5 Years),249,3.7,"12,111"
https://www.amazon.in/Wildcraft-Green-Casual-Backpack-11650-Green/dp/B079DV66TY/ref=sr_1_166?crid=2M096C61O4MLT&keywords=bags&qid=1692794812&sprefix=ba%2Caps%2C283&sr=8-166,Wildcraft 29.5 Ltrs Green Casual Backpack (11650-Green),994,4.1,402
https://www.amazon.in/URBAN-CARRIER-Polyester-Resistant-Backpack/dp/B091ZG2NCX/ref=sr_1_167?crid=2M096C61O4MLT&keywords=bags&qid=1692794812&sprefix=ba%2Caps%2C283&sr=8-167,URBAN CARRIER 30 Liters Polyester Water Resistant Heavy Duty | Backpack | College Bag | Laptop Bag for Men & Women-UBC0002,431,3.6,66
https://www.amazon.in/Backpack-Colleges-Luggage-Waterproof-Stylish/dp/B09GYGCK54/ref=sr_1_168?crid=2M096C61O4MLT&keywords=bags&qid=1692794812&sprefix=ba%2Caps%2C283&sr=8-168,URBAN CARRIER Large 45 Liters Medium Backpack for school and colleges laptop bag luggage bag travel bag Unisex office bag for men Waterproof School Bag for girls stylish backpack for men,579,3.9,511
