https://www.amazon.in/Crossbody-Waterproof-Daypack-Charging-Locomotive/dp/B0BCQ762R6/ref=sr_1_169?crid=2M096C61O4MLT&keywords=bags&qid=1692794812&sprefix=ba%2Caps%2C283&sr=8-169,HOXSURY Sling Backpack USB Anti-Theft Waterproof Chest Daypack Casual Shoulder Bag,"1,199",4.4,84
https://www.amazon.in/TRUE-Anti-Theft-backpack-charging-Epower_B/dp/B0BYBDX8VP/ref=sr_1_170?crid=2M096C61O4MLT&keywords=bags&qid=1692794812&sprefix=ba%2Caps%2C283&sr=8-170,"TRUE HUMAN® Emperor Anti-Theft Pocket backpack With USB charging Port Laptop,office,college,travel bag for men and women(Epower)",599,3.6,266
https://www.amazon.in/Skybags-Cardiff-Polyester-Travel-DFTCAR62ERED/dp/B073JSGMRS/ref=sr_1_173?crid=2M096C61O4MLT&keywords=bags&qid=1692794812&sprefix=ba%2Caps%2C283&sr=8-173,Skybags Cardiff Polyester 63.5 Cms Travel Duffle Bag (Red),"1,908",4.2,"5,023"
https://www.amazon.in/DIVULGE-Drawstring-Bag-Sports-Utility/dp/B07PXTDBH4/ref=sr_1_174?crid=2M096C61O4MLT&keywords=bags&qid=1692794812&sprefix=ba%2Caps%2C283&sr=8-174,"DIVULGE Multi Utility Drawstring Bag (Black , 16 L)",145,4.0,"1,159"
https://www.amazon.in/DZert-Polyester-Black-White-Laptop/dp/B07H193V57/ref=sr_1_175?crid=2M096C61O4MLT&keywords=bags&qid=1692794812&sprefix=ba%2Caps%2C283&sr=8-175,DZert Clasy Laptop Bag College Bag for Boys Girls 21 L Black,339,3.8,"2,547"
https://www.amazon.in/Derben-Fabric-Leather-Laptop-Messenger/dp/B08TVL3MWJ/ref=sr_1_176?crid=2M096C61O4MLT&keywords=bags&qid=1692794812&sprefix=ba%2Caps%2C283&sr=8-176,"DERBEN CLOVE® 15.6 Men and Women Laptop, MacBook Shoulder Messenger Sling Office Bag - Grey",899,4.1,162
https://www.amazon.in/Ant-Esports-Knight-protection-Laptop-Dynamic/dp/B0BZ4WCJHR/ref=sr_1_177?crid=2M096C61O4MLT&keywords=bags&qid=1692794812&sprefix=ba%2Caps%2C283&sr=8-177,"Ant Esports Knight Cobra 23, Large 38L Stylish unisex backpack with USB Charging Port, Earphone/Headphone Port, with rain protection cover and reflective strip, fits upto 17"" Laptop-Dynamic Blue",683,3.9,6
https://www.amazon.in/ASTRID-Blue-Diamond-Textured-Cotton/dp/B08W5DQ33D/ref=sr_1_178?crid=2M096C61O4MLT&keywords=bags&qid=1692794812&sprefix=ba%2Caps%2C283&sr=8-178,ASTRID Blue Diamond Textured Cotton Tote Bag,589,4.4,226
https://www.amazon.in/HARISSONS-15-6-inch-Backpack-Organizers-Detachable/dp/B07M5P5LW3/ref=sr_1_179?crid=2M096C61O4MLT&keywords=bags&qid=1692794812&sprefix=ba%2Caps%2C283&sr=8-179,"HARISSONS Bags Vervo 15.6-inch Laptop/Travel/Casual Backpack for Men and Women with Rain Cover (Black, 40 Ltrs) | Quick Access Zippered Pocket, Detailed Organizers & a Detachable Key Chain Holder","2,960",4.4,"2,016"
https://www.amazon.in/DIVULGE-Sparkk-Drawstring-Daypack-Backpack/dp/B091TRRXWZ/ref=sr_1_180?crid=2M096C61O4MLT&keywords=bags&qid=1692794812&sprefix=ba%2Caps%2C283&sr=8-180,DIVULGE Spark Polyester Daypack Drawstring Rucksack Backpack With Zip Pocket (Black Drawstring 2.0),189,4.1,110
https://www.amazon.in/sspa/click?ie=UTF8&spc=MTozMDE0NzIxMDc4NjAzNTk5OjE2OTI3OTQ4MTI6c3BfYnRmOjIwMDkwNjY0ODg1OTk4OjowOjo&url=%2FXForce-Plaza-Backpack-Interface-Breakers%2Fdp%2FB0BKWRVQX2%2Fref%3Dsr_1_181_sspa%3Fcrid%3D2M096C61O4MLT%26keywords%3Dbags%26qid%3D1692794812%26sprefix%3Dba%252Caps%252C283%26sr%3D8-181-spons%26sp_csd%3Dd2lkZ2V0TmFtZT1zcF9idGY%26psc%3D1,"XForce Plaza Bangtan Boys KPOP Casual Backpack,USB and Audio Cable Interface Breakers Suitable for Students Laptop Backpack","1,299",3.9,22
https://www.amazon.in/sspa/click?ie=UTF8&spc=MTozMDE0NzIxMDc4NjAzNTk5OjE2OTI3OTQ4MTI6c3BfYnRmOjIwMDMwODU5NjEwMTAzOjowOjo&url=%2FBackpack-Business-Computer-Luggage-Resistant%2Fdp%2FB084LBMKMT%2Fref%3Dsr_1_182_sspa%3Fcrid%3D2M096C61O4MLT%26keywords%3Dbags%26qid%3D1692794812%26sprefix%3Dba%252Caps%252C283%26sr%3D8-182-spons%26sp_csd%3Dd2lkZ2V0TmFtZT1zcF9idGY%26psc%3D1,"Arctic Hunter Backpack 15.6 Inch Laptop Bag Water-resistant Slim Business Backpack for Office Travel School Smart Bag with USB Port for Men and Women, Black","2,659",4.3,145
https://www.amazon.in/sspa/click?ie=UTF8&spc=MTo3OTU3NjY2NTQ1MDEwNTk5OjE2OTI3OTQ4MTU6c3BfYXRmX25leHQ6MjAwNzAxMDM2NzAxOTg6OjA6Og&url=%2FGOLD-SKY-Polyester-Shoulder-Backpack%2Fdp%2FB0B1HXG9KL%2Fref%3Dsr_1_177_sspa%3Fcrid%3D2M096C61O4MLT%26keywords%3Dbags%26qid%3D1692794815%26sprefix%3Dba%252Caps%252C283%26sr%3D8-177-spons%26sp_csd%3Dd2lkZ2V0TmFtZT1zcF9hdGZfbmV4dA%26psc%3D1,GOLD SKY Polyester Casual 35L Laptop Travel Shoulder Office Day trip College Backpack For Men & Women With Rain Cover,764,3.5,44
https://www.amazon.in/sspa/click?ie=UTF8&spc=MTo3OTU3NjY2NTQ1MDEwNTk5OjE2OTI3OTQ4MTU6c3BfYXRmX25leHQ6MjAwODI2NTgwMjM4OTg6OjA6Og&url=%2FSwiss-Military-Backpack-Pockets-LTB5A%2Fdp%2FB0BHJ9WMZK%2Fref%3Dsr_1_178_sspa%3Fcrid%3D2M096C61O4MLT%26keywords%3Dbags%26qid%3D1692794815%26sprefix%3Dba%252Caps%252C283%26sr%3D8-178-spons%26sp_csd%3Dd2lkZ2V0TmFtZT1zcF9hdGZfbmV4dA%26psc%3D1%26smid%3DA9XP90DC1X0F8,"Swiss Military Laptop Soft Roller Case Cum Backpack with Rain Cover, Quick Access Pockets, 23 Ltrs Trolley Bag, LTB5A","3,295",3.6,14
https://www.amazon.in/Gear-Classic-Leather-Backpack-LBPCLSLTH0519/dp/B07G4JQX2F/ref=sr_1_179?crid=2M096C61O4MLT&keywords=bags&qid=1692794815&sprefix=ba%2Caps%2C283&sr=8-179,Gear Classic 20L Faux Leather Water Resistant Anti Theft Laptop Bag/Backpack for Men/Women (Navy-Tan),979,4.4,"6,595"
https://www.amazon.in/URBAN-CARRIER-Polyester-Resistant-Backpack/dp/B091ZG2NCX/ref=sr_1_180?crid=2M096C61O4MLT&keywords=bags&qid=1692794815&sprefix=ba%2Caps%2C283&sr=8-180,URBAN CARRIER 30 Liters Polyester Water Resistant Heavy Duty | Backpack | College Bag | Laptop Bag for Men & Women-UBC0002,431,3.6,66
https://www.amazon.in/Murano-Casual-daybackpack-Office-College/dp/B0BX9FLPNX/ref=sr_1_181?crid=2M096C61O4MLT&keywords=bags&qid=1692794815&sprefix=ba%2Caps%2C283&sr=8-181,Murano Louis 10ltr Casual daybackpack/Office & Travel Bag/School Bag/College Bag/Men/Women/Girl/Boy (Orange),269,3.1,76
https://www.amazon.in/Backpack-Colleges-Luggage-Waterproof-Stylish/dp/B09GYGCK54/ref=sr_1_182?crid=2M096C61O4MLT&keywords=bags&qid=1692794815&sprefix=ba%2Caps%2C283&sr=8-182,URBAN CARRIER Large 45 Liters Medium Backpack for school and colleges laptop bag luggage bag travel bag Unisex office bag for men Waterproof School Bag for girls stylish backpack for men,579,3.9,511
https://www.amazon.in/Puma-Ltrs-Cms-Backpack-7837402_Grey/dp/B089T98TKG/ref=sr_1_183?crid=2M096C61O4MLT&keywords=bags&qid=1692794815&sprefix=ba%2Caps%2C283&sr=8-183,Puma Unisex Gym Bag IND,899,4.0,482
https://www.amazon.in/Skybags-Unisex-Polyester-Pattern-Hustle/dp/B07F342RQD/ref=sr_1_184?crid=2M096C61O4MLT&keywords=bags&qid=1692794815&sprefix=ba%2Caps%2C283&sr=8-184,"Skybags Unisex Polyester Solid Pattern Hustle Df 55 (Orange, Small)","1,580",4.4,325
https://www.amazon.in/TRUE-Anti-Theft-backpack-charging-Epower_B/dp/B0BYBDX8VP/ref=sr_1_185?crid=2M096C61O4MLT&keywords=bags&qid=1692794815&sprefix=ba%2Caps%2C283&sr=8-185,"TRUE HUMAN® Emperor Anti-Theft Pocket backpack With USB charging Port Laptop,office,college,travel bag for men and women(Epower)",599,3.6,266
https://www.amazon.in/Gear-Universe-Resistant-Backpack-Daypack/dp/B0BZWLBDV3/ref=sr_1_186?crid=2M096C61O4MLT&keywords=bags&qid=1692794815&sprefix=ba%2Caps%2C283&sr=8-186,Gear Galaxy Universe 30 L Water Resistant School Bag/Kids Bag/Casual Backpack/Daypack/College Bag for Boys/Girls/Men/Women (Blue),"1,095",3.7,32
https://www.amazon.in/sspa/click?ie=UTF8&spc=MTo3OTU3NjY2NTQ1MDEwNTk5OjE2OTI3OTQ4MTU6c3BfbXRmOjIwMTY2ODUwMjk3Nzk4OjowOjo&url=%2FVeneer-Genuine-Leather-Backpack-Business%2Fdp%2FB0BWZMN94W%2Fref%3Dsr_1_188_sspa%3Fcrid%3D2M096C61O4MLT%26keywords%3Dbags%26qid%3D1692794815%26sprefix%3Dba%252Caps%252C283%26sr%3D8-188-spons%26sp_csd%3Dd2lkZ2V0TmFtZT1zcF9tdGY%26psc%3D1,Veneer Vegan Genuine Leather Backpack 15.6 Inch Laptop Backpack Business Travel Laptop Backpack for Mens and Womens,"1,984",5.0,1
https://www.amazon.in/uppercase-Backpack-2300EBP1-repellent-sustainable/dp/B0B69M182Q/ref=sr_1_189?crid=2M096C61O4MLT&keywords=bags&qid=1692794815&sprefix=ba%2Caps%2C283&sr=8-189,"uppercase Medium 17 Ltrs Vegan Leather (upto 14 inch) Laptop Backpack 2300EBP1 3x more water resistant sustainable bags with rain proof zippers for Men, Women, Boys and Girls, 750 Days warranty","1,600",4.0,540
https://www.amazon.in/DZert-Polyester-Black-White-Laptop/dp/B07H193V57/ref=sr_1_190?crid=2M096C61O4MLT&keywords=bags&qid=1692794815&sprefix=ba%2Caps%2C283&sr=8-190,DZert Clasy Laptop Bag College Bag for Boys Girls 21 L Black,339,3.8,"2,547"
https://www.amazon.in/Derben-Fabric-Leather-Laptop-Messenger/dp/B08TVL3MWJ/ref=sr_1_191?crid=2M096C61O4MLT&keywords=bags&qid=1692794815&sprefix=ba%2Caps%2C283&sr=8-191,"DERBEN CLOVE® 15.6 Men and Women Laptop, MacBook Shoulder Messenger Sling Office Bag - Grey",899,4.1,162
https://www.amazon.in/Ant-Esports-Knight-protection-Laptop-Dynamic/dp/B0BZ4WCJHR/ref=sr_1_192?crid=2M096C61O4MLT&keywords=bags&qid=1692794815&sprefix=ba%2Caps%2C283&sr=8-192,"Ant Esports Knight Cobra 23, Large 38L Stylish unisex backpack with USB Charging Port, Earphone/Headphone Port, with rain protection cover and reflective strip, fits upto 17"" Laptop-Dynamic Blue",683,3.9,6
https://www.amazon.in/WildHorn-Leather-39-37-Messenger-WHBB101/dp/B01H8U62VU/ref=sr_1_193?crid=2M096C61O4MLT&keywords=bags&qid=1692794815&sprefix=ba%2Caps%2C283&sr=8-193,WildHorn Leather Laptop Messenger Bag for Mens,"2,389",3.9,278
https://www.amazon.in/DIVULGE-Sparkk-Drawstring-Daypack-Backpack/dp/B091TRRXWZ/ref=sr_1_194?crid=2M096C61O4MLT&keywords=bags&qid=1692794815&sprefix=ba%2Caps%2C283&sr=8-194,DIVULGE Spark Polyester Daypack Drawstring Rucksack Backpack With Zip Pocket (Black Drawstring 2.0),189,4.1,110
https://www.amazon.in/NORTH-ZONE-Northzone-Business-Messenger/dp/B0C555LQF4/ref=sr_1_195?crid=2M096C61O4MLT&keywords=bags&qid=1692794815&sprefix=ba%2Caps%2C283&sr=8-195,NORTH ZONE Northzone Sling Cross Body Travel Office Business Messenger One Side Shoulder Pouch Bag Money Bag for Men and Women,249,3.8,70
https://www.amazon.in/Lavie-Womens-Ushawu-Satchel-Handbag/dp/B0B3J9J9CK/ref=sr_1_196?crid=2M096C61O4MLT&keywords=bags&qid=1692794815&sprefix=ba%2Caps%2C283&sr=8-196,Lavie Women's Ushawu Satchel Bag | Ladies Purse Handbag,"1,099",4.1,"7,036"
https://www.amazon.in/sspa/click?ie=UTF8&spc=MTo3OTU3NjY2NTQ1MDEwNTk5OjE2OTI3OTQ4MTU6c3BfYnRmOjMwMDAxMzUxNjQyNzEzMjo6MDo6&url=%2FBACDA-Backpack-Business-Notebook-Black-01%2Fdp%2FB0BMVRVSG6%2Fref%3Dsr_1_197_sspa%3Fcrid%3D2M096C61O4MLT%26keywords%3Dbags%26qid%3D1692794815%26sprefix%3Dba%252Caps%252C283%26sr%3D8-197-spons%26sp_csd%3Dd2lkZ2V0TmFtZT1zcF9idGY%26psc%3D1,BACDA Laptop Backpack Laptop Bags Casual 38L Office School Travel Business Bag Backpack for Men Women Boys Girls Fits 15.6 Inch Laptop and Notebook (1017) (Black-01),989,4.0,21
https://www.amazon.in/sspa/click?ie=UTF8&spc=MTo3OTU3NjY2NTQ1MDEwNTk5OjE2OTI3OTQ4MTU6c3BfYnRmOjIwMTUyNzQwNjAxNTk4OjowOjo&url=%2FRed-Lemon-Unisex-adult-Waterproof-Charging%2Fdp%2FB09VGP6H2Y%2Fref%3Dsr_1_198_sspa%3Fcrid%3D2M096C61O4MLT%26keywords%3Dbags%26qid%3D1692794815%26sprefix%3Dba%252Caps%252C283%26sr%3D8-198-spons%26sp_csd%3Dd2lkZ2V0TmFtZT1zcF9idGY%26psc%3D1,Red Lemon Medium Size Unisex Adult Bange Series Rhombus Shell Design Waterproof Sling Bag With Usb Charging,"1,899",4.1,94
https://www.amazon.in/sspa/click?ie=UTF8&spc=MToyNDMzMzM1NjI4OTg0NTk5OjE2OTI3OTQ4MTg6c3BfYXRmX25leHQ6MzAwMDA5ODQ4MDcxODMyOjowOjo&url=%2FDolfin-Backpack-Charging-Resistant-Compartment%2Fdp%2FB0C5RL3F5L%2Fref%3Dsr_1_194_sspa%3Fcrid%3D2M096C61O4MLT%26keywords%3Dbags%26qid%3D1692794818%26sprefix%3Dba%252Caps%252C283%26sr%3D8-194-spons%26sp_csd%3Dd2lkZ2V0TmFtZT1zcF9hdGZfbmV4dA%26psc%3D1,"Dolfin WaterProof Unisex Laptop Backpack 32L with USB Charging Port C, 15.6 inch Compartment, Water-Resistant and Scratch Resistant, Premium Material Laptop Office Bag for Men and Women","1,699",5.0,3
https://www.amazon.in/Puma-Ltrs-Cms-Backpack-7837402_Grey/dp/B089T98TKG/ref=sr_1_195?crid=2M096C61O4MLT&keywords=bags&qid=1692794818&sprefix=ba%2Caps%2C283&sr=8-195,Puma Unisex Gym Bag IND,899,4.0,482
https://www.amazon.in/Skybags-Unisex-Polyester-Pattern-Hustle/dp/B07F342RQD/ref=sr_1_196?crid=2M096C61O4MLT&keywords=bags&qid=1692794818&sprefix=ba%2Caps%2C283&sr=8-196,"Skybags Unisex Polyester Solid Pattern Hustle Df 55 (Orange, Small)","1,580",4.4,325
https://www.amazon.in/WILDHORN-Backpack-Compartment-Business-Bookbags/dp/B09P2RP9TG/ref=sr_1_197?crid=2M096C61O4MLT&keywords=bags&qid=1692794818&sprefix=ba%2Caps%2C283&sr=8-197,WILDHORN Laptop Backpack for Men/Women I Waterproof I Travel/Business/College Bookbags Fit 15.6 Inch Laptop,799,4.0,281
https://www.amazon.in/Gear-Universe-Resistant-Backpack-Daypack/dp/B0BZWLBDV3/ref=sr_1_198?crid=2M096C61O4MLT&keywords=bags&qid=1692794818&sprefix=ba%2Caps%2C283&sr=8-198,Gear Galaxy Universe 30 L Water Resistant School Bag/Kids Bag/Casual Backpack/Daypack/College Bag for Boys/Girls/Men/Women (Blue),"1,095",3.7,32
https://www.amazon.in/uppercase-Backpack-2300EBP1-repellent-sustainable/dp/B0B69M182Q/ref=sr_1_199?crid=2M096C61O4MLT&keywords=bags&qid=1692794818&sprefix=ba%2Caps%2C283&sr=8-199,"uppercase Medium 17 Ltrs Vegan Leather (upto 14 inch) Laptop Backpack 2300EBP1 3x more water resistant sustainable bags with rain proof zippers for Men, Women, Boys and Girls, 750 Days warranty","1,600",4.0,540
https://www.amazon.in/Aristocrat-Ltrs-Black-Rucksack-Duro/dp/B07VB76WL9/ref=sr_1_200?crid=2M096C61O4MLT&keywords=bags&qid=1692794818&sprefix=ba%2Caps%2C283&sr=8-200,Aristocrat 45 Ltrs Black Rucksack,"1,500",4.0,343
https://www.amazon.in/WildHorn-Leather-39-37-Messenger-WHBB101/dp/B01H8U62VU/ref=sr_1_201?crid=2M096C61O4MLT&keywords=bags&qid=1692794818&sprefix=ba%2Caps%2C283&sr=8-201,WildHorn Leather Laptop Messenger Bag for Mens,"2,389",3.9,278
https://www.amazon.in/Tabelito%C2%AE-Delta-Waterproof-Backpack-Compatible/dp/B0BLK2RL23/ref=sr_1_202?crid=2M096C61O4MLT&keywords=bags&qid=1692794818&sprefix=ba%2Caps%2C283&sr=8-202,"Tabelito® DELTA Casual Waterproof Laptop Backpack/Office Bag/School Bag/College Bag/Business Bag/Unisex Travel Backpack (Compatible with 15.6 inch Laptop) 30 L, (6 Month Warranty)",599,4.2,124
https://www.amazon.in/sspa/click?ie=UTF8&spc=MToyNDMzMzM1NjI4OTg0NTk5OjE2OTI3OTQ4MTg6c3BfbXRmOjMwMDAyMDM4MzIxNTQzMjo6MDo6&url=%2FAFN-FASHION-Casual-bagpack-Backpack%2Fdp%2FB081X69ZL7%2Fref%3Dsr_1_203_sspa%3Fcrid%3D2M096C61O4MLT%26keywords%3Dbags%26qid%3D1692794818%26sprefix%3Dba%252Caps%252C283%26sr%3D8-203-spons%26sp_csd%3Dd2lkZ2V0TmFtZT1zcF9tdGY%26psc%3D1,AFN FASHION 45 Ltrs Casual backpack/office/School Bag/Laptop Backpack for (15.6 inch) Blue,749,3.9,"1,676"
https://www.amazon.in/NORTH-ZONE-Northzone-Business-Messenger/dp/B0C555LQF4/ref=sr_1_205?crid=2M096C61O4MLT&keywords=bags&qid=1692794818&sprefix=ba%2Caps%2C283&sr=8-205,NORTH ZONE Northzone Sling Cross Body Travel Office Business Messenger One Side Shoulder Pouch Bag Money Bag for Men and Women,249,3.8,70
https://www.amazon.in/Lavie-Womens-Ushawu-Satchel-Handbag/dp/B0B3J9J9CK/ref=sr_1_206?crid=2M096C61O4MLT&keywords=bags&qid=1692794818&sprefix=ba%2Caps%2C283&sr=8-206,Lavie Women's Ushawu Satchel Bag | Ladies Purse Handbag,"1,099",4.1,"7,036"
https://www.amazon.in/TRUE-EMPEROR-charging-college-CAPTAIN/dp/B0C6HZDWRQ/ref=sr_1_207?crid=2M096C61O4MLT&keywords=bags&qid=1692794818&sprefix=ba%2Caps%2C283&sr=8-207,"TRUE HUMAN® EMPEROR 15.6 inch laptop bag with USB charging port Laptop bag,office bag, college bags anti theft (CAPTAIN)",649,3.9,21
https://www.amazon.in/Storite-Cross-Travel-Dark-Grey/dp/B07PFF4RYC/ref=sr_1_208?crid=2M096C61O4MLT&keywords=bags&qid=1692794818&sprefix=ba%2Caps%2C283&sr=8-208,Storite Stylish Padded Small Nylon Sling Cross Body Travel Office Business Messenger One Side Shoulder Bag for Men Women (25x16x7.5cm) (Dark Grey),395,4.1,"8,667"
https://www.amazon.in/Wooum-Resistant-Material-Messenger-Compartment/dp/B09KV7Y3KL/ref=sr_1_209?crid=2M096C61O4MLT&keywords=bags&qid=1692794818&sprefix=ba%2Caps%2C283&sr=8-209,Wooum Water Resistant Material Sling Bag/One Side Bag/Shoulder Bag/Messenger Bag/Office Messenger Bag/Travel Side Bag with 14.1 Inch Laptop Compartment -,474,4.0,296
https://www.amazon.in/Puma-Black-Laptop-Backpack-7573301/dp/B07JHJCZSM/ref=sr_1_210?crid=2M096C61O4MLT&keywords=bags&qid=1692794818&sprefix=ba%2Caps%2C283&sr=8-210,PUMA 26 Ltrs Puma Black Laptop Backpack,"1,319",3.7,90
https://www.amazon.in/Bennett-15-6-inch-College-Repellent-Backpack/dp/B09WZHX3B1/ref=sr_1_211?crid=2M096C61O4MLT&keywords=bags&qid=1692794818&sprefix=ba%2Caps%2C283&sr=8-211,"Bennett Casual Laptop Bag school bags for boys girls 15.6-inch, 25 LTR Office & College bags for mens Water Repellent Backpack for Men & Women (Black)",512,3.9,716
https://www.amazon.in/HYDER-Superhero-Lightweight-Spacious-Waterproof/dp/B0BJ6CTJ3Q/ref=sr_1_212?crid=2M096C61O4MLT&keywords=bags&qid=1692794818&sprefix=ba%2Caps%2C283&sr=8-212,HYDER Kids 20L Cartoon Printed Best Stylish Lightweight Spacious Waterproof Casual/Picnic/Tuition/School Bag/Backpack for Children Boys And Girls,499,3.9,330
https://www.amazon.in/sspa/click?ie=UTF8&spc=MToyNDMzMzM1NjI4OTg0NTk5OjE2OTI3OTQ4MTg6c3BfYnRmOjIwMDYxNjA5MjU0NDk4OjowOjo&url=%2FSafari-Overnighter-Expandable-Travelling-All-Purpose%2Fdp%2FB097JN1VZX%2Fref%3Dsr_1_213_sspa%3Fcrid%3D2M096C61O4MLT%26keywords%3Dbags%26qid%3D1692794818%26sprefix%3Dba%252Caps%252C283%26sr%3D8-213-spons%26sp_csd%3Dd2lkZ2V0TmFtZT1zcF9idGY%26psc%3D1,"Safari Seek 45 Ltrs Overnighter Expandable Travel Laptop Backpack with RainCover (Blue), Water Resistant Spacious Bag pack for Travelling and Camping, All-Purpose Bag for Business & Travel","2,039",4.4,200
https://www.amazon.in/sspa/click?ie=UTF8&spc=MToyNDMzMzM1NjI4OTg0NTk5OjE2OTI3OTQ4MTg6c3BfYnRmOjIwMTQ2NjQ5NTg4NTk4OjowOjo&url=%2FPramadda-Pure-Luxury-Backpack-Bagpacks%2Fdp%2FB0C2KHQ8Z1%2Fref%3Dsr_1_214_sspa%3Fcrid%3D2M096C61O4MLT%26keywords%3Dbags%26qid%3D1692794818%26sprefix%3Dba%252Caps%252C283%26sr%3D8-214-spons%26sp_csd%3Dd2lkZ2V0TmFtZT1zcF9idGY%26psc%3D1,"Pramadda Pure Luxury Italian Vegan leather Croco Backpack For Men and Women | 15.6"" inch Laptop Bag For Office College Travel | Premium Bagpacks With Antique Brass Hardware (Elegant Black)","1,499",4.8,41
https://www.amazon.in/sspa/click?ie=UTF8&spc=MTo1MzcxNjQ4NzkyNzIyNTk5OjE2OTI3OTQ4MjE6c3BfYXRmX25leHQ6MzAwMDExMTY2ODM4NzMyOjowOjo&url=%2FSafari-SAGE18FBBLK-Sage-Formal-Backpack%2Fdp%2FB097JLZBK3%2Fref%3Dsr_1_209_sspa%3Fcrid%3D2M096C61O4MLT%26keywords%3Dbags%26qid%3D1692794821%26sprefix%3Dba%252Caps%252C283%26sr%3D8-209-spons%26sp_csd%3Dd2lkZ2V0TmFtZT1zcF9hdGZfbmV4dA%26psc%3D1,Sage Formal Backpack - black,"3,499",5.0,3
https://www.amazon.in/Storite-Cross-Travel-Dark-Grey/dp/B07PFF4RYC/ref=sr_1_211?crid=2M096C61O4MLT&keywords=bags&qid=1692794821&sprefix=ba%2Caps%2C283&sr=8-211,Storite Stylish Padded Small Nylon Sling Cross Body Travel Office Business Messenger One Side Shoulder Bag for Men Women (25x16x7.5cm) (Dark Grey),395,4.1,"8,667"
https://www.amazon.in/Bennett-15-6-inch-College-Repellent-Backpack/dp/B09WZHX3B1/ref=sr_1_212?crid=2M096C61O4MLT&keywords=bags&qid=1692794821&sprefix=ba%2Caps%2C283&sr=8-212,"Bennett Casual Laptop Bag school bags for boys girls 15.6-inch, 25 LTR Office & College bags for mens Water Repellent Backpack for Men & Women (Black)",512,3.9,716
https://www.amazon.in/HYDER-Superhero-Lightweight-Spacious-Waterproof/dp/B0BJ6CTJ3Q/ref=sr_1_213?crid=2M096C61O4MLT&keywords=bags&qid=1692794821&sprefix=ba%2Caps%2C283&sr=8-213,HYDER Kids 20L Cartoon Printed Best Stylish Lightweight Spacious Waterproof Casual/Picnic/Tuition/School Bag/Backpack for Children Boys And Girls,499,3.9,330
https://www.amazon.in/Gear-Executive-Anti-Theft-Backpack-BKPPKREXE0101/dp/B097KCMQKG/ref=sr_1_214?crid=2M096C61O4MLT&keywords=bags&qid=1692794821&sprefix=ba%2Caps%2C283&sr=8-214,Gear Parker 23L Water Resistant Anti Theft Laptop Bag/Backpack for Men/Women - Black,744,4.3,451
https://www.amazon.in/ADISA-BP004-Weight-Casual-Backpack/dp/B07G3F1G7T/ref=sr_1_215?crid=2M096C61O4MLT&keywords=bags&qid=1692794821&sprefix=ba%2Caps%2C283&sr=8-215,ADISA Laptop Backpack 31 Ltrs,399,4.0,"9,048"
https://www.amazon.in/Anti-Theft-Lightweight-15-6-inch-Multi-pockets-Water-resistant/dp/B0BRZ7RQCF/ref=sr_1_216?crid=2M096C61O4MLT&keywords=bags&qid=1692794821&sprefix=ba%2Caps%2C283&sr=8-216,"Arctic Hunter Slim Backpack Business Anti-Theft Laptop Bag for Men Lightweight Padded Backpack for 15.6-inch Laptop and iPad Multi-pockets Outdoor Medium Water-resistant Bag with USB Port for Office Travel College, Black","2,374",4.5,89
https://www.amazon.in/F-Gear-Repel-Laptop-Backpacks/dp/B01GTS0LS2/ref=sr_1_217?crid=2M096C61O4MLT&keywords=bags&qid=1692794821&sprefix=ba%2Caps%2C283&sr=8-217,F Gear Repel 30 ltrs Rain and Dust Cover for Laptop Bags and Backpacks,250,4.1,"2,296"
https://www.amazon.in/STRAUSS-Jute-Yoga-Shoulder-Strap/dp/B0BBWM221J/ref=sr_1_218?crid=2M096C61O4MLT&keywords=bags&qid=1692794821&sprefix=ba%2Caps%2C283&sr=8-218,"STRAUSS Yoga Mat Bag Cover with Shoulder Strap with Pocket for Men & Women, Drawstring and Full Zip,(Multicolor)",219,3.6,761
https://www.amazon.in/sspa/click?ie=UTF8&spc=MTo1MzcxNjQ4NzkyNzIyNTk5OjE2OTI3OTQ4MjE6c3BfbXRmOjIwMDM1NTc4Nzc4Njk4OjowOjo&url=%2FCOSMUS-Eternal-Backpack-Polyester-15-6-inch%2Fdp%2FB09SWVPZD4%2Fref%3Dsr_1_220_sspa%3Fcrid%3D2M096C61O4MLT%26keywords%3Dbags%26qid%3D1692794821%26sprefix%3Dba%252Caps%252C283%26sr%3D8-220-spons%26sp_csd%3Dd2lkZ2V0TmFtZT1zcF9tdGY%26psc%3D1,COSMUS Eternal Laptop Backpack 20 Ltrs Polyester Bags for 15.6-inch Laptops,952,3.2,18
https://www.amazon.in/Harissons-Office-Laptop-Backpacks-Women/dp/B09D3YYYNG/ref=sr_1_221?crid=2M096C61O4MLT&keywords=bags&qid=1692794821&sprefix=ba%2Caps%2C283&sr=8-221,HARISSONS Bags Volt 15.6 inch Office Laptop Backpacks for Men and Women 24 Ltrs with 2 Front Zippered Pockets & Spacious Large Compartments | External USB Gate for easy Charging,"1,504",4.1,273
https://www.amazon.in/Safari-Formal-Backpack-Anti-Theft-VAULT19CBBLK/dp/B07XSTR69N/ref=sr_1_222?crid=2M096C61O4MLT&keywords=bags&qid=1692794821&sprefix=ba%2Caps%2C283&sr=8-222,"Safari 48 Cms Black Formal/Office/Laptop Backpack With Anti-Theft, Lock, Usb And Rfid (Vault19Cbblk)",997,4.0,897
https://www.amazon.in/Safari-Overnighter-Resistant-Travelling-All-Purpose/dp/B097JMR4M6/ref=sr_1_223?crid=2M096C61O4MLT&keywords=bags&qid=1692794821&sprefix=ba%2Caps%2C283&sr=8-223,"Safari Seek 32 Ltrs Large Overnighter Travel Laptop Backpack, Water Resistant Spacious Bag for Travelling and Camping, All-Purpose Bag for Business & Leisure- Black","2,089",4.4,275
https://www.amazon.in/Lunars-Router-Resistant-Raincover-Organiser/dp/B08YR63B9M/ref=sr_1_224?crid=2M096C61O4MLT&keywords=bags&qid=1692794821&sprefix=ba%2Caps%2C283&sr=8-224,"Lunar's 35 L Laptop Office/School/Travel/Business Backpack Water Proof - Fits Up to 15.6 Inch Laptop Notebook, With Raincover, Inside Organiser and 1 Year Warranty (All)",778,3.8,"1,138"
https://www.amazon.in/Wildcraft-Nylon-Broken-Casual-Backpack/dp/B083ZSY54M/ref=sr_1_225?crid=2M096C61O4MLT&keywords=bags&qid=1692794821&sprefix=ba%2Caps%2C283&sr=8-225,"Wildcraft Nylon 35 L Broken Camo Green Casual Backpack (Grey, H x W x D:46x32x24)","1,098",4.0,91
https://www.amazon.in/DIVULGE-Sparkk-Drawstring-Daypack-Backpack/dp/B091TRRXWZ/ref=sr_1_226?crid=2M096C61O4MLT&keywords=bags&qid=1692794821&sprefix=ba%2Caps%2C283&sr=8-226,DIVULGE Spark Polyester Daypack Drawstring Rucksack Backpack With Zip Pocket (Black Drawstring 2.0),189,4.1,110
https://www.amazon.in/Gear-DOUBLE-DECKER-Resistant-Backpack/dp/B0BTJ3WTMV/ref=sr_1_227?crid=2M096C61O4MLT&keywords=bags&qid=1692794821&sprefix=ba%2Caps%2C283&sr=8-227,Gear DOUBLE DECKER 31L Water Resistant Laptop Bag/Backpack/Office Bag for Men/Women (Black),"1,399",4.0,31
https://www.amazon.in/Comfabie-Backpack-Multipurpose-Handbags-Shoulder/dp/B0BNQJM7Q9/ref=sr_1_228?crid=2M096C61O4MLT&keywords=bags&qid=1692794821&sprefix=ba%2Caps%2C283&sr=8-228,Comfabie Large Size Fashion Backpack Purses Multipurpose Design Handbags & Shoulder Bag Pu Leather Travel Bag Vegan Leather Travel Casual Collage Backpack With Shoulder Printed Strap,799,3.8,343
https://www.amazon.in/sspa/click?ie=UTF8&spc=MTo1MzcxNjQ4NzkyNzIyNTk5OjE2OTI3OTQ4MjE6c3BfYnRmOjIwMDk3NjEyMjMxOTk4OjowOjo&url=%2Fuppercase-resistant-sustainable-Rainproof-Detachable%2Fdp%2FB0BC4B4VRM%2Fref%3Dsr_1_229_sspa%3Fcrid%3D2M096C61O4MLT%26keywords%3Dbags%26qid%3D1692794821%26sprefix%3Dba%252Caps%252C283%26sr%3D8-229-spons%26sp_csd%3Dd2lkZ2V0TmFtZT1zcF9idGY%26psc%3D1,"uppercase 22 Ltrs Large (14.6 inch) Laptop Backpack 2900EBP1 Bucket Outdoor 3x more water repellent sustainable bag with Rainproof zipper & Detachable organizer for Men, Women, Boys and Girls , 750 Days warranty","1,600",4.5,32
https://www.amazon.in/sspa/click?ie=UTF8&spc=MTo1MzcxNjQ4NzkyNzIyNTk5OjE2OTI3OTQ4MjE6c3BfYnRmOjIwMTQ1MjM3NjgzNTk4OjowOjo&url=%2FZipline-Polyester-Laptop-Backpack-college%2Fdp%2FB0BTPWMJ9Y%2Fref%3Dsr_1_230_sspa%3Fcrid%3D2M096C61O4MLT%26keywords%3Dbags%26qid%3D1692794821%26sprefix%3Dba%252Caps%252C283%26sr%3D8-230-spons%26sp_csd%3Dd2lkZ2V0TmFtZT1zcF9idGY%26psc%3D1,Zipline Polyester 33Ltr Laptop Bags Backpack for Men and Women college girls boys fits 15.6 inch laptop,"1,098",1.0,1
https://www.amazon.in/sspa/click?ie=UTF8&spc=MToyMzEyODI0MzQ4NjE3NTk5OjE2OTI3OTQ4MjQ6c3BfYXRmX25leHQ6MjAxNjAyNDk1MDkyOTg6OjA6Og&url=%2Fuppercase-Professional-Anti-Theft-Overnighter-sustainable%2Fdp%2FB0C4PRDZ9X%2Fref%3Dsr_1_226_sspa%3Fcrid%3D2M096C61O4MLT%26keywords%3Dbags%26qid%3D1692794824%26sprefix%3Dba%252Caps%252C283%26sr%3D8-226-spons%26sp_csd%3Dd2lkZ2V0TmFtZT1zcF9hdGZfbmV4dA%26psc%3D1,uppercase Nexus Professional Anti-Theft Overnighter Travel Laptop Backpack,"2,500",4.9,11
https://www.amazon.in/Wildcraft-Nylon-Broken-Casual-Backpack/dp/B083ZSY54M/ref=sr_1_227?crid=2M096C61O4MLT&keywords=bags&qid=1692794824&sprefix=ba%2Caps%2C283&sr=8-227,"Wildcraft Nylon 35 L Broken Camo Green Casual Backpack (Grey, H x W x D:46x32x24)","1,098",4.0,91
