https://www.amazon.in/Zebronics-TechshieldA1-Compartment-15-6-inch-Polyester/dp/B0C6QV9GCY/ref=sr_1_55?crid=2M096C61O4MLT&keywords=bags&qid=1692794788&sprefix=ba%2Caps%2C283&sr=8-55,"Zebronics TechshieldA1, 18 Liters, 1 Compartment Laptop Backpack and Front Pocket, fit Up to 15.6-inch Laptop, Polyester Fabric, Office Use and Mini Business Travel Bags (Light Grey)",599,5.0,4
https://www.amazon.in/Half-Moon-Trekking-Bags-Compartment/dp/B08PSX1LN9/ref=sr_1_56?crid=2M096C61O4MLT&keywords=bags&qid=1692794788&sprefix=ba%2Caps%2C283&sr=8-56,Half Moon 45L Hammer Waterproof Laptop Travelling Rucksack Trekking Backpack for Travel Journey bags for Men Women Boys & Girls with 17.3inch Laptop Compartment & Rain cover,"1,349",4.1,"1,431"
https://www.amazon.in/Nivia-6853BKGR-Polyester-Black-Grey/dp/B07NLB6FRS/ref=sr_1_57?crid=2M096C61O4MLT&keywords=bags&qid=1692794788&sprefix=ba%2Caps%2C283&sr=8-57,NIVIA Basic Duffle Polyester Bag/Gym Bags/Adjustable Shoulder Bag for Men/Duffle Gym Bags for Men/Fitness Bag/Carry Bags/Sports & Travel Bag/Sports Kit/Duffle Bags Travel,229,4.0,"3,850"
https://www.amazon.in/Bagneeds-Synthetic-Leather-Briefcase-Messenger/dp/B0855F8174/ref=sr_1_58?crid=2M096C61O4MLT&keywords=bags&qid=1692794788&sprefix=ba%2Caps%2C283&sr=8-58,Bagneeds Men's Black Synthetic Leather Briefcase Best Laptop Messenger Bag Satchel for Men,699,4.1,"4,611"
https://www.amazon.in/sspa/click?ie=UTF8&spc=MTo0MjQ0NjYxNzA3ODA3NTk5OjE2OTI3OTQ3ODg6c3BfbXRmOjMwMDAyNDk5ODI1NzczMjo6MDo6&url=%2FEUME-Ease-Built-Anti-Theft-Up%2Fdp%2FB07NZBG7YX%2Fref%3Dsr_1_59_sspa%3Fcrid%3D2M096C61O4MLT%26keywords%3Dbags%26qid%3D1692794788%26sprefix%3Dba%252Caps%252C283%26sr%3D8-59-spons%26sp_csd%3Dd2lkZ2V0TmFtZT1zcF9tdGY%26psc%3D1,"EUME Ease - 31L Premium Laptop Bag for Men, Black | Built-in Massager, Water Resistant & Anti-Theft | Fits Up-to 15.6"" MacBook | Travel Bag | Business Bag |Office Bag for Men & Women","5,599",3.8,23
https://www.amazon.in/Step-Backpack-Small-Water-Repellant/dp/B088XG77KN/ref=sr_1_61?crid=2M096C61O4MLT&keywords=bags&qid=1692794788&sprefix=ba%2Caps%2C283&sr=8-61,"Mi Step Out 12 L Mini Backpack (Small Size, Red, Water Repellant)",398,4.1,"9,714"
https://www.amazon.in/ADISA-Laptop-Backpack-Office-College/dp/B0BPTV3795/ref=sr_1_62?crid=2M096C61O4MLT&keywords=bags&qid=1692794788&sprefix=ba%2Caps%2C283&sr=8-62,ADISA 32L large laptop backpack office bag college travel back pack with rain cover,599,3.9,322
https://www.amazon.in/NORTH-ZONE-Waterproof-Backpack-Dimensions/dp/B0BS6QM2GD/ref=sr_1_63?crid=2M096C61O4MLT&keywords=bags&qid=1692794788&sprefix=ba%2Caps%2C283&sr=8-63,NORTH ZONE Casual Waterproof Laptop Backpack/Office Bag/School Bag/College Bag/Business Bag/Travel Backpack (Dimensions:13x18 inches) (Compatible with 39.62cm(15.6inch laptop) 30 L,630,4.0,607
https://www.amazon.in/Nivia-Deflate-5180BK-Polyester-Round/dp/B07222KX3S/ref=sr_1_64?crid=2M096C61O4MLT&keywords=bags&qid=1692794788&sprefix=ba%2Caps%2C283&sr=8-64,NIVIA Deflate Round 01 Polyester Gym Bag/Unisex Gym Bags/Adjustable Shoulder Bag for Men/Duffle Gym Bags for Men/Carry Gym Accessories/Fitness Bag/Sports &Travel Bag/Gym kit Bag (Black),459,4.2,"7,556"
https://www.amazon.in/DZert-Panda-School-Backpacks-Cartoon/dp/B07WSBV3BN/ref=sr_1_65?crid=2M096C61O4MLT&keywords=bags&qid=1692794788&sprefix=ba%2Caps%2C283&sr=8-65,DZert Kids School Bag Soft Plush Backpacks Cartoon Boys Girls Baby (2-5 Years),249,3.7,"12,111"
https://www.amazon.in/SFANE-Duffel-Shoulder-Women-Compartment/dp/B07ZC77WTW/ref=sr_1_66?crid=2M096C61O4MLT&keywords=bags&qid=1692794788&sprefix=ba%2Caps%2C283&sr=8-66,"SFANE Polyester 23 cms Navy Blue Gym Bag, Shoulder Bag, Sports Bag for Men & Women with Separate Shoes Compartment (Blue)",437,4.4,"3,027"
https://www.amazon.in/Tabelito-NEO-Backpack-Business-Compartment/dp/B0C2D2GPWJ/ref=sr_1_67?crid=2M096C61O4MLT&keywords=bags&qid=1692794788&sprefix=ba%2Caps%2C283&sr=8-67,"Tabelito® NEO 3O L Water Resistant Laptop/College/Office/School/Travel/Business Bag, Unisex Backpack for Men Women Fits Up to 15.6 Inch Laptop Notebook.",399,4.0,191
https://www.amazon.in/Lavie-Sport-Chairman-Compatible-compartments/dp/B09YCSCRBW/ref=sr_1_68?crid=2M096C61O4MLT&keywords=bags&qid=1692794788&sprefix=ba%2Caps%2C283&sr=8-68,Lavie Sport Chairman Backpack with Laptop Sleeve | Premium Leatherette Business Backpack for Men & Women | Durable Office Bag for Notebook/MacBook,849,3.9,"1,410"
https://www.amazon.in/sspa/click?ie=UTF8&spc=MTo0MjQ0NjYxNzA3ODA3NTk5OjE2OTI3OTQ3ODg6c3BfYnRmOjIwMTAzMjc2MzA0MTk4OjowOjo&url=%2FGeneric-FRBG-004-FRBG-NAVY-LAPTOP-BACKPACK%2Fdp%2FB0B5VHV5NH%2Fref%3Dsr_1_69_sspa%3Fcrid%3D2M096C61O4MLT%26keywords%3Dbags%26qid%3D1692794788%26sprefix%3Dba%252Caps%252C283%26sr%3D8-69-spons%26sp_csd%3Dd2lkZ2V0TmFtZT1zcF9idGY%26psc%3D1,FRBG-NAVY BLUE LAPTOP BACKPACK,799,5.0,1
https://www.amazon.in/sspa/click?ie=UTF8&spc=MTozMzYzODUwMTI3Mjk1NTk5OjE2OTI3OTQ3OTE6c3BfYXRmX25leHQ6MjAxNDU5NTM5MTU3OTg6OjA6Og&url=%2FImpulse-Parkar-Backpack-Business-Resistant%2Fdp%2FB0C1H2PRCF%2Fref%3Dsr_1_65_sspa%3Fcrid%3D2M096C61O4MLT%26keywords%3Dbags%26qid%3D1692794791%26sprefix%3Dba%252Caps%252C283%26sr%3D8-65-spons%26sp_csd%3Dd2lkZ2V0TmFtZT1zcF9hdGZfbmV4dA%26psc%3D1,Impulse Parkar 40L Laptop Backpack/Office Bag/School Bag/College Bag/Business Bag/Travel Backpack Water Resistant Fits Up to 16 Inch Laptop with 1 Year Warranty,"1,529",3.7,4
https://www.amazon.in/sspa/click?ie=UTF8&spc=MTozMzYzODUwMTI3Mjk1NTk5OjE2OTI3OTQ3OTE6c3BfYXRmX25leHQ6MjAxMTU5NTU1NTY0OTg6OjA6Og&url=%2Fuppercase-Backpack-2500EBP1-resistant-sustainable%2Fdp%2FB0BTDB674X%2Fref%3Dsr_1_66_sspa%3Fcrid%3D2M096C61O4MLT%26keywords%3Dbags%26qid%3D1692794791%26sprefix%3Dba%252Caps%252C283%26sr%3D8-66-spons%26sp_csd%3Dd2lkZ2V0TmFtZT1zcF9hdGZfbmV4dA%26psc%3D1,"uppercase Medium 23 Ltrs Tall Boy (14.6 inch) Laptop Backpack 2500EBP1 3x more water resistant sustainable bag with rain proof zippers for Men, Women, Boys and Girls, 750 Days warranty","1,700",4.0,269
https://www.amazon.in/Lunars-Bingo-Laptop-Resistant-48L/dp/B08YZ5XY31/ref=sr_1_67?crid=2M096C61O4MLT&keywords=bags&qid=1692794791&sprefix=ba%2Caps%2C283&sr=8-67,Lunar's Bingo - 48 L Laptop Office/School/Travel/Business Backpack Water Resistant - Fits Up to 15.6 Inch Laptop Notebook with 1 Year Warranty,819,3.9,"10,111"
https://www.amazon.in/Shalimar-Capacity-Travel-Storage-Duffel/dp/B09TPHFMX7/ref=sr_1_68?crid=2M096C61O4MLT&keywords=bags&qid=1692794791&sprefix=ba%2Caps%2C283&sr=8-68,"SHALIMAR large capacity Travel bag / Storage bag / Move-in bags/ Duffel Bag - Strong, Durable , Foldable and Water Resistant ( Pack of 1 ) ( Blue )",305,4.1,500
https://www.amazon.in/Tabelito-NEXA-Backpack-Business-Compartment/dp/B0C2D3YR7T/ref=sr_1_69?crid=2M096C61O4MLT&keywords=bags&qid=1692794791&sprefix=ba%2Caps%2C283&sr=8-69,"Tabelito® NEXA 3O L Water Resistant Laptop/College/Office/School/Travel/Business Bag, Unisex Backpack for Men Women Fits Up to 15.6 Inch Laptop Notebook. (GREY)",399,4.2,116
https://www.amazon.in/Backpack-Business-Backpacks-Charging-Resistant/dp/B094DGX84G/ref=sr_1_70?crid=2M096C61O4MLT&keywords=bags&qid=1692794791&sprefix=ba%2Caps%2C283&sr=8-70,"FUR JADEN Travel Laptop Backpack, Business Backpacks with USB Charging Port, Water Resistant College School Computer Bag for Men & Women Fits Under 15.6 inch Laptop and Notebook",949,4.3,545
https://www.amazon.in/ROZEN-School-partition-Collage-Backpack/dp/B0BRTDXVZC/ref=sr_1_71?crid=2M096C61O4MLT&keywords=bags&qid=1692794791&sprefix=ba%2Caps%2C283&sr=8-71,"ROZEN 47 Ltrs, 46 cms School Bag Class 5-12 Large 5 partition Laptop Collage Office Travel Backpack Unisex",697,4.0,209
https://www.amazon.in/Wesley-Liter-Casual-Daypack-Backpack/dp/B0BVVY98PZ/ref=sr_1_72?crid=2M096C61O4MLT&keywords=bags&qid=1692794791&sprefix=ba%2Caps%2C283&sr=8-72,Wesley 15 Liter Casual Daypack Backpack,169,3.7,191
https://www.amazon.in/Martucci-Casual-Travelling-Laptop-Backpack/dp/B088B4P6ZW/ref=sr_1_73?crid=2M096C61O4MLT&keywords=bags&qid=1692794791&sprefix=ba%2Caps%2C283&sr=8-73,Martucci 15.6 inch 30 L Casual Waterproof Laptop Backpack/Office Bag/School Bag/College Bag/Business Bag/Unisex Travel Backpack(Black),549,3.9,"7,774"
https://www.amazon.in/Half-Moon-Waterproof-Backpack-Students/dp/B0BR149RMT/ref=sr_1_74?crid=2M096C61O4MLT&keywords=bags&qid=1692794791&sprefix=ba%2Caps%2C283&sr=8-74,Half Moon 35 L Casual Waterproof Laptop Bag/Backpack for Men Women Boys Girls/Office School College Teens & Students with Rain Cover (18 Inch) (Sky Blue),699,3.6,105
https://www.amazon.in/sspa/click?ie=UTF8&spc=MTozMzYzODUwMTI3Mjk1NTk5OjE2OTI3OTQ3OTE6c3BfbXRmOjIwMDk4NzE5MDg2ODk4OjowOjo&url=%2FRed-Lemon-Unisex-adult-Waterproof-Charging%2Fdp%2FB09VGNTDRZ%2Fref%3Dsr_1_75_sspa%3Fcrid%3D2M096C61O4MLT%26keywords%3Dbags%26qid%3D1692794791%26sprefix%3Dba%252Caps%252C283%26sr%3D8-75-spons%26sp_csd%3Dd2lkZ2V0TmFtZT1zcF9tdGY%26psc%3D1,Red Lemon Medium Size Unisex Adult Bange Series Rhombus Shell Design Waterproof Sling Bag With Usb Charging,"1,899",4.1,94
https://www.amazon.in/sspa/click?ie=UTF8&spc=MTozMzYzODUwMTI3Mjk1NTk5OjE2OTI3OTQ3OTE6c3BfbXRmOjIwMTM1Mzg3ODI2ODk4OjowOjo&url=%2FWILDHORN-Backpack-Compartment-Business-Stitching%2Fdp%2FB09QL66G55%2Fref%3Dsr_1_76_sspa%3Fcrid%3D2M096C61O4MLT%26keywords%3Dbags%26qid%3D1692794791%26sprefix%3Dba%252Caps%252C283%26sr%3D8-76-spons%26sp_csd%3Dd2lkZ2V0TmFtZT1zcF9tdGY%26psc%3D1,"WILDHORN 31L Laptop Backpack for Men/Women I Fits upto 15.6"" Laptop I Waterproof I Travel/Business/College Bookbags",599,4.1,"1,621"
https://www.amazon.in/Genie-Ltrs-School-Backpack-SPRAY19SBBLU/dp/B07QFF2RZR/ref=sr_1_77?crid=2M096C61O4MLT&keywords=bags&qid=1692794791&sprefix=ba%2Caps%2C283&sr=8-77,"Genie Spray School Bag for Girls, 19 inch Backpack for Women, 3 compartments Water Resistant Stylish and Trendy College Backpacks for Girls","1,155",4.0,"1,665"
https://www.amazon.in/ADISA-Laptop-Backpack-Office-College/dp/B0BPVCBFM7/ref=sr_1_78?crid=2M096C61O4MLT&keywords=bags&qid=1692794791&sprefix=ba%2Caps%2C283&sr=8-78,ADISA 32L large laptop backpack office bag college travel back pack with rain cover,599,3.9,322
https://www.amazon.in/AirCase-C34-Laptop-Backpack-Women/dp/B07QL8633G/ref=sr_1_79?crid=2M096C61O4MLT&keywords=bags&qid=1692794791&sprefix=ba%2Caps%2C283&sr=8-79,"AirCase Laptop Bag Backpack Case Pouch for Laptop Backpack for Men & Women,Premium Vegan Leather",929,3.9,"1,095"
https://www.amazon.in/WILD-MODA-Womens-Shoulder-Turquoise/dp/B099PLT91X/ref=sr_1_80?crid=2M096C61O4MLT&keywords=bags&qid=1692794791&sprefix=ba%2Caps%2C283&sr=8-80,"WILD MODA Women's Shoulder Bag, Set of 1",849,4.2,"3,372"
https://www.amazon.in/Number-Backpack-Compartment-Charging-Organizer/dp/B09VTC876Z/ref=sr_1_81?crid=2M096C61O4MLT&keywords=bags&qid=1692794791&sprefix=ba%2Caps%2C283&sr=8-81,"FUR JADEN Anti Theft Number Lock Backpack Bag with 15.6 Inch Laptop Compartment, USB Charging Port & Organizer Pocket for Men Women Boys Girls",670,4.0,"5,655"
https://www.amazon.in/Nivia-5183-Polyester-Duffle-Medium/dp/B071KNXQ7Y/ref=sr_1_82?crid=2M096C61O4MLT&keywords=bags&qid=1692794791&sprefix=ba%2Caps%2C283&sr=8-82,NIVIA Beast Gym Bag-4 Polyester/Unisex Gym Bags/Shoulder Bag for Men & Women with Separate Shoes Compartment/Carry Gym Accessories/Fitness Bag/Sports & Travel Bag/Sports Kit,499,4.2,"3,506"
https://www.amazon.in/Safari-Overnighter-Resistant-Polyester-Travelling/dp/B097JK3X9D/ref=sr_1_83?crid=2M096C61O4MLT&keywords=bags&qid=1692794791&sprefix=ba%2Caps%2C283&sr=8-83,"Safari Crew Overnighter Backpack, 40 Ltr Water Resistant Travel Laptop Bag, Black Polyester Backpack for Men and Women, Spacious Shoulder Bag for Travelling and Camping","1,709",4.3,263
https://www.amazon.in/Motherly-Stylish-Babies-Diaper-Mothers/dp/B07DMKJJB4/ref=sr_1_84?crid=2M096C61O4MLT&keywords=bags&qid=1692794791&sprefix=ba%2Caps%2C283&sr=8-84,motherly Stylish Babies Diaper Bags for Mothers - Economical Version (Grey and Pink),"1,799",4.6,"5,926"
https://www.amazon.in/sspa/click?ie=UTF8&spc=MTozMzYzODUwMTI3Mjk1NTk5OjE2OTI3OTQ3OTE6c3BfYnRmOjMwMDAyNTU3OTQ2ODUzMjo6MDo6&url=%2FAmazon-Basics-15-6-Inch-Backpack-College%2Fdp%2FB0C8NX7HTX%2Fref%3Dsr_1_85_sspa%3Fcrid%3D2M096C61O4MLT%26keywords%3Dbags%26qid%3D1692794791%26sprefix%3Dba%252Caps%252C283%26sr%3D8-85-spons%26sp_csd%3Dd2lkZ2V0TmFtZT1zcF9idGY%26psc%3D1,"Amazon Basics Opel 15.6-Inch Laptop Backpack for Office or College (20 L, Black)",639,4.2,146
https://www.amazon.in/sspa/click?ie=UTF8&spc=MTozMzYzODUwMTI3Mjk1NTk5OjE2OTI3OTQ3OTE6c3BfYnRmOjMwMDAzOTM4NTgxOTIzMjo6MDo6&url=%2FDenim-Multiorganizer-Backpack-Compatible-laptop%2Fdp%2FB0BVK989RZ%2Fref%3Dsr_1_86_sspa%3Fcrid%3D2M096C61O4MLT%26keywords%3Dbags%26qid%3D1692794791%26sprefix%3Dba%252Caps%252C283%26sr%3D8-86-spons%26sp_csd%3Dd2lkZ2V0TmFtZT1zcF9idGY%26psc%3D1,Denim Multiorganizer Backpack Compatible with 15.6 inch laptop,485,3.4,14
https://www.amazon.in/sspa/click?ie=UTF8&spc=MToyNDA2NzEzNDU0Njg1OTk6MTY5Mjc5NDc5NTpzcF9hdGZfbmV4dDoyMDExODM2MjY4NjA5ODo6MDo6&url=%2FUPPERCASE-Professional-Backpack-resistant-sustainable%2Fdp%2FB0BTYTY8GG%2Fref%3Dsr_1_81_sspa%3Fcrid%3D2M096C61O4MLT%26keywords%3Dbags%26qid%3D1692794795%26sprefix%3Dba%252Caps%252C283%26sr%3D8-81-spons%26sp_csd%3Dd2lkZ2V0TmFtZT1zcF9hdGZfbmV4dA%26psc%3D1,"UPPERCASE Sigma Professional Laptop Backpack (15.6 Inch) 3x more water resistant sustainable bags with rain proof zippers for Men, Women, Boys and Girls, 750 Days warranty","2,100",4.7,24
https://www.amazon.in/FUR-JADEN-Backpack-Accessories-Organiser/dp/B0BSHBH9K2/ref=sr_1_83?crid=2M096C61O4MLT&keywords=bags&qid=1692794795&sprefix=ba%2Caps%2C283&sr=8-83,"FUR JADEN 15.6 Inch Smart Laptop Backpack Bag With USB Charging Port, Anti Theft Pocket and Accessories Organiser for Men Women Boys Girls","1,329",4.1,700
https://www.amazon.in/Genie-Flamenco2-Backpack-Compatible-Resistant/dp/B08YF9VHTY/ref=sr_1_84?crid=2M096C61O4MLT&keywords=bags&qid=1692794795&sprefix=ba%2Caps%2C283&sr=8-84,Genie Flamenco2 Casual Backpacks for Women,733,4.3,"1,558"
https://www.amazon.in/Genie-Miami-litres-Casual-Backpack/dp/B07SRGGGNC/ref=sr_1_85?crid=2M096C61O4MLT&keywords=bags&qid=1692794795&sprefix=ba%2Caps%2C283&sr=8-85,"Genie Miami Laptop Backpack for Women,Tuition bag, 16 inches Office Bag, Sky Blue Stylish and Trendy Bag for Office and College",803,4.2,"1,489"
https://www.amazon.in/Safari-Sheild-Resistant-Casual-Backpack/dp/B09B28M2RN/ref=sr_1_86?crid=2M096C61O4MLT&keywords=bags&qid=1692794795&sprefix=ba%2Caps%2C283&sr=8-86,Safari Sheild 26 Ltrs Water Resistant Casual Backpack - (SHEILD19CBBLK),709,4.0,562
https://www.amazon.in/HEROZ-Backpack-Resistant-Computer-17-3-inch/dp/B083N3DCTM/ref=sr_1_87?crid=2M096C61O4MLT&keywords=bags&qid=1692794795&sprefix=ba%2Caps%2C283&sr=8-87,HEROZ Hacker 50 litres Large Size Nylon Travel Laptop Backpack Water Resistant Slim Durable Computer Book Bag Tracking Fits Up to 17.3-inch Laptop (058- ALL) (Navy Blue),"1,599",4.2,"3,930"
https://www.amazon.in/Half-Moon-Waterproof-Backpack-Grey/dp/B09688CSCZ/ref=sr_1_88?crid=2M096C61O4MLT&keywords=bags&qid=1692794795&sprefix=ba%2Caps%2C283&sr=8-88,Half Moon 34 L Water Resistant 15.6 inch Laptop Bag/Backpack for Men Women Boys Girls/Office School College with Padded Laptop Compartment (Grey),698,3.9,"1,373"
https://www.amazon.in/Gear-Vintage2-Leather-Backpack-LBPVG2LTH0501/dp/B07G4HH78P/ref=sr_1_89?crid=2M096C61O4MLT&keywords=bags&qid=1692794795&sprefix=ba%2Caps%2C283&sr=8-89,Gear Vintage2 28L Medium Size Faux Leather Water Resistant Anti Theft Unisex LaptopBackpack- Navy,979,4.4,"3,352"
https://www.amazon.in/ALIZA-Womens-Tote-Bag-Black/dp/B08JJ8RQNR/ref=sr_1_90?crid=2M096C61O4MLT&keywords=bags&qid=1692794795&sprefix=ba%2Caps%2C283&sr=8-90,Aliza Women's Tote Bag,403,4.0,"8,902"
https://www.amazon.in/sspa/click?ie=UTF8&spc=MToyNDA2NzEzNDU0Njg1OTk6MTY5Mjc5NDc5NTpzcF9tdGY6MjAwOTc1Nzk1MDE4OTg6OjA6Og&url=%2Fuppercase-Medium-Laptop-Backpack-2100EBP1%2Fdp%2FB0B68Y7H6F%2Fref%3Dsr_1_92_sspa%3Fcrid%3D2M096C61O4MLT%26keywords%3Dbags%26qid%3D1692794795%26sprefix%3Dba%252Caps%252C283%26sr%3D8-92-spons%26sp_csd%3Dd2lkZ2V0TmFtZT1zcF9tdGY%26psc%3D1,uppercase 14 Ltrs Medium (14.6 Inch) Laptop Backpack 2100EBP1 Roll Top Office College 3x More Water Repellent Sustainable Bags With Rainproof Zippers For Unisex,"1,000",4.2,180
https://www.amazon.in/Frantic-Velvet-School-Nursery-Travelling/dp/B091757GK4/ref=sr_1_93?crid=2M096C61O4MLT&keywords=bags&qid=1692794795&sprefix=ba%2Caps%2C283&sr=8-93,"Frantic Soft Cartoon Animal Velvet Plush School Backpack Bag For 2 To 5 Years Boys/Girls - Nursery, Preschool, Picnic",309,3.8,"4,623"
https://www.amazon.in/Bennett-15-6-inch-College-Repellent-Backpack/dp/B09WZKHSDR/ref=sr_1_94?crid=2M096C61O4MLT&keywords=bags&qid=1692794795&sprefix=ba%2Caps%2C283&sr=8-94,"Bennett Casual Laptop Bag School Bags for Boys Girls 15.6-inch, 25 LTR Office & College bags for Mens Water Repellent Backpack for Men & Women (GREY)",512,3.9,716
https://www.amazon.in/Tabelito-NEO-Backpack-Business-Compartment/dp/B0C2D2Q52R/ref=sr_1_95?crid=2M096C61O4MLT&keywords=bags&qid=1692794795&sprefix=ba%2Caps%2C283&sr=8-95,"Tabelito® NEO 3O L Water Resistant Laptop/College/Office/School/Travel/Business Bag, Unisex Backpack for Men Women Fits Up to 15.6 Inch Laptop Notebook.",399,4.0,191
https://www.amazon.in/LOOKMUSTER-Waterproof-Backpack-College-Business/dp/B0BS6YGKMC/ref=sr_1_96?crid=2M096C61O4MLT&keywords=bags&qid=1692794795&sprefix=ba%2Caps%2C283&sr=8-96,LOOKMUSTER Casual Waterproof Laptop Backpack/Office Bag/School Bag/College Bag/Business Bag/Travel Backpack…,613,3.9,45
https://www.amazon.in/BEAUTY-GIRLS-HOTSHOT1566-Backpack-Waterproof/dp/B0BG36CZD9/ref=sr_1_97?crid=2M096C61O4MLT&keywords=bags&qid=1692794795&sprefix=ba%2Caps%2C283&sr=8-97,BEAUTY GIRLS BY HOTSHOT1566|School Bag|Tuition Bag|College Backpack|ForGirls&Women|17Inch|32L Waterproof School Bag,740,4.1,198
https://www.amazon.in/Fur-Jaden-Charging-Waterproof-BM36_BlueZip/dp/B07MXM5M99/ref=sr_1_98?crid=2M096C61O4MLT&keywords=bags&qid=1692794795&sprefix=ba%2Caps%2C283&sr=8-98,"Fur Jaden 15.6 Inch Laptop Backpack 25 LTR Bag for School, College and Office with USB Charging Port",479,3.9,"10,367"
https://www.amazon.in/F-Gear-String-Polyester-33-cms-Black-Drawstring-Gym-Bag/dp/B07PC28YQ9/ref=sr_1_99?crid=2M096C61O4MLT&keywords=bags&qid=1692794795&sprefix=ba%2Caps%2C283&sr=8-99,F Gear String 11 Ltrs Nylon Black Gym Bag,190,4.0,594
https://www.amazon.in/Gear-Training-Travel-Duffel-DUFCRSTNG4314/dp/B098FG3GVX/ref=sr_1_100?crid=2M096C61O4MLT&keywords=bags&qid=1692794795&sprefix=ba%2Caps%2C283&sr=8-100,Gear Polyester 23 Cms Travel Bag(DUFCRSTNG4314_Khaki),478,4.1,563
https://www.amazon.in/sspa/click?ie=UTF8&spc=MToyNDA2NzEzNDU0Njg1OTk6MTY5Mjc5NDc5NTpzcF9idGY6MjAwOTc2MTIyMzEyOTg6OjA6Og&url=%2Fuppercase-Overnighter-Backpack-Repellent-Sustainable%2Fdp%2FB0B8NV9YX3%2Fref%3Dsr_1_101_sspa%3Fcrid%3D2M096C61O4MLT%26keywords%3Dbags%26qid%3D1692794795%26sprefix%3Dba%252Caps%252C283%26sr%3D8-101-spons%26sp_csd%3Dd2lkZ2V0TmFtZT1zcF9idGY%26psc%3D1,uppercase Medium 21 Ltrs Office Overnighter (14.6 inch) Laptop Backpack 2700EBP1 3x More Water Repellent Sustainable Bags with Rain Proof Zippers Maroon,"1,550",3.7,32
https://www.amazon.in/sspa/click?ie=UTF8&spc=MTo3OTU3MjA4OTUzMjc2NTk5OjE2OTI3OTQ3OTg6c3BfYXRmX25leHQ6MzAwMDEyMzM5NDMyODMyOjowOjo&url=%2FHOEXL-Expandable-Laptop-Backpack-Water-resistant%2Fdp%2FB0C3J2RLHP%2Fref%3Dsr_1_97_sspa%3Fcrid%3D2M096C61O4MLT%26keywords%3Dbags%26qid%3D1692794798%26sprefix%3Dba%252Caps%252C283%26sr%3D8-97-spons%26sp_csd%3Dd2lkZ2V0TmFtZT1zcF9hdGZfbmV4dA%26psc%3D1,"HOEXL 42L Expandable Laptop Backpack - Premium Laptop Backpacks for Men, Women for Travel, School, College - Tech Bag with USB - Bagpacker Bag for Men, 17 inch Laptop Bags for Multipurpose with Water-resistant, Smart Bag with Multiple Compartments","2,699",5.0,35
https://www.amazon.in/sspa/click?ie=UTF8&spc=MTo3OTU3MjA4OTUzMjc2NTk5OjE2OTI3OTQ3OTg6c3BfYXRmX25leHQ6MjAwOTA4NjE5ODYyOTg6OjA6Og&url=%2FSwiss-Military-Laptop-Backpack-Canvas%2Fdp%2FB09T9NS7SB%2Fref%3Dsr_1_98_sspa%3Fcrid%3D2M096C61O4MLT%26keywords%3Dbags%26qid%3D1692794798%26sprefix%3Dba%252Caps%252C283%26sr%3D8-98-spons%26sp_csd%3Dd2lkZ2V0TmFtZT1zcF9hdGZfbmV4dA%26psc%3D1,Swiss Military Multi Utility Backpack with USB Charging Port - LBP89 and Combo Offers,"2,401",3.7,59
https://www.amazon.in/Killer-Backpack-Compartments-Polyester-Waterproof/dp/B07CDD6YS2/ref=sr_1_99?crid=2M096C61O4MLT&keywords=bags&qid=1692794798&sprefix=ba%2Caps%2C283&sr=8-99,KILLER Louis 38L Large Laptop Backpack With 3 Compartments Polyester Trendy Waterproof Travel Backpack,"2,067",4.4,"11,414"
https://www.amazon.in/Waterproof-Backpack-Students-adjustable-Compartment/dp/B09V5HRYR7/ref=sr_1_100?crid=2M096C61O4MLT&keywords=bags&qid=1692794798&sprefix=ba%2Caps%2C283&sr=8-100,CAPRIFF 32 L Casual Waterproof Laptop Bag/Backpack for Men Boys & Girls For Office School College Teens & Students with Rain Cover With adjustable Strap With 2 Compartment,699,3.8,"3,138"
https://www.amazon.in/Half-Moon-Backpack-Spacious-Multiple/dp/B0C6N3MYL2/ref=sr_1_101?crid=2M096C61O4MLT&keywords=bags&qid=1692794798&sprefix=ba%2Caps%2C283&sr=8-101,Half Moon Aztec 37L School Bag Class 5-12 | College Bagpack for Men/College Back pack for Women | 15.6 inch Laptop Bag for Men/Backpack for Men | Spacious & Multiple Pockets,649,3.6,237
https://www.amazon.in/Safari-Casual-Backpack-Charging-Resistant/dp/B09B2581S9/ref=sr_1_102?crid=2M096C61O4MLT&keywords=bags&qid=1692794798&sprefix=ba%2Caps%2C283&sr=8-102,"Safari Sneak Casual Backpack with USB Charging Port 26 Ltrs Water Resistant Fabric - Grey, L (SNEAK19CBGRE)",959,3.7,"1,054"
https://www.amazon.in/Safari-Duffle-Travel-Luggage-Trolley/dp/B097JJXL9K/ref=sr_1_103?crid=2M096C61O4MLT&keywords=bags&qid=1692794798&sprefix=ba%2Caps%2C283&sr=8-103,Safari Arc Polyester 55 Cms 2 Wheel Travel Duffel Bag (Red),"1,309",3.8,400
https://www.amazon.in/American-Tourister-FS0-11-001/dp/B07S13P8BW/ref=sr_1_104?crid=2M096C61O4MLT&keywords=bags&qid=1692794798&sprefix=ba%2Caps%2C283&sr=8-104,American Tourister Spin 49 cms Teal Laptop Backpack,"1,699",4.0,"1,495"
https://www.amazon.in/Martucci-Backpack-College-Reflective-Airport/dp/B0B7DVC3TL/ref=sr_1_105?crid=2M096C61O4MLT&keywords=bags&qid=1692794798&sprefix=ba%2Caps%2C283&sr=8-105,Martucci Large 35 L Backpack Spacy Unisex/College/School/Travel Backpack with Rain Cover and Reflective Strip,758,4.0,"1,260"
https://www.amazon.in/Skybags-Unisex-Grey-Jacqard-Laptop/dp/B09ZV9SLBJ/ref=sr_1_106?crid=2M096C61O4MLT&keywords=bags&qid=1692794798&sprefix=ba%2Caps%2C283&sr=8-106,Skybags Unisex Grey Jacqard 34L Laptop Bags,"1,248",4.1,85
https://www.amazon.in/sspa/click?ie=UTF8&spc=MTo3OTU3MjA4OTUzMjc2NTk5OjE2OTI3OTQ3OTg6c3BfbXRmOjIwMDk3NjEyMjMxNTk4OjowOjo&url=%2Fuppercase-Backpack-2000EBP1-repellent-sustainable%2Fdp%2FB0B8NX7SXR%2Fref%3Dsr_1_107_sspa%3Fcrid%3D2M096C61O4MLT%26keywords%3Dbags%26qid%3D1692794798%26sprefix%3Dba%252Caps%252C283%26sr%3D8-107-spons%26sp_csd%3Dd2lkZ2V0TmFtZT1zcF9tdGY%26psc%3D1,"uppercase Medium 20 Ltrs Casual (14.6 inch) Laptop Backpack 2000EBP1 3x more water repellent sustainable bags with rain proof zippers for Men, Women, Boys and Girls, 750 Days warranty","1,000",3.8,32
https://www.amazon.in/sspa/click?ie=UTF8&spc=MTo3OTU3MjA4OTUzMjc2NTk5OjE2OTI3OTQ3OTg6c3BfbXRmOjMwMDAzOTQxOTM2NTYzMjo6MDo6&url=%2FImpulse-Imptag-Backpack-Business-Resistant%2Fdp%2FB0C1CRFTFP%2Fref%3Dsr_1_108_sspa%3Fcrid%3D2M096C61O4MLT%26keywords%3Dbags%26qid%3D1692794798%26sprefix%3Dba%252Caps%252C283%26sr%3D8-108-spons%26sp_csd%3Dd2lkZ2V0TmFtZT1zcF9tdGY%26psc%3D1,Impulse Imptag 45L Laptop Backpack/Office Bag/School Bag/College Bag/Business Bag/Travel Backpack Water Resistant Fits Up to 16 Inch Laptop with Rain Cover & 1 Year Warranty,702,3.2,18
https://www.amazon.in/BEAUTY-GIRLS-HOTSHOT1570-Backpack-Waterproof/dp/B0BYDR7W41/ref=sr_1_109?crid=2M096C61O4MLT&keywords=bags&qid=1692794798&sprefix=ba%2Caps%2C283&sr=8-109,BEAUTY GIRLS BY HOTSHOT1570|School Bag|Tuition Bag|College Backpack|ForGirls&Women|18Inch|25L Waterproof School Bag,689,4.0,56
https://www.amazon.in/DZert-School-Polyester-Backpack-White/dp/B07GXYHFCY/ref=sr_1_110?crid=2M096C61O4MLT&keywords=bags&qid=1692794798&sprefix=ba%2Caps%2C283&sr=8-110,DZert Clasy Laptop Bag College Bag for Boys Girls 21 L Blue White,339,3.8,"2,547"
https://www.amazon.in/Red-Lemon-Backpack-Accessories-Organiser/dp/B0C2KRH268/ref=sr_1_111?crid=2M096C61O4MLT&keywords=bags&qid=1692794798&sprefix=ba%2Caps%2C283&sr=8-111,"Red Lemon Swiss Cut Design 15.6 Inch Smart Laptop Backpack Bag With USB Charging Port, Anti Theft Pocket and Accessories Organiser for Men Women Boys Girls","1,799",4.4,"1,149"
https://www.amazon.in/ALIZA-Womens-Tote-Bag-Black/dp/B08JJ8RQNR/ref=sr_1_112?crid=2M096C61O4MLT&keywords=bags&qid=1692794798&sprefix=ba%2Caps%2C283&sr=8-112,Aliza Women's Tote Bag,403,4.0,"8,902"
https://www.amazon.in/FALONG-Resistant-Sweat-Proof-Adjustable-Headphone/dp/B0C9HRR6NW/ref=sr_1_113?crid=2M096C61O4MLT&keywords=bags&qid=1692794798&sprefix=ba%2Caps%2C283&sr=8-113,"FALONG Waist Bag for Men & Women Water Resistant Running Waist Pack, Running Belt with Large Capacity, Sweat-Proof Adjustable Elastic Strap and Headphone Hole, Ideal for All Mobile Phones",320,4.7,8
https://www.amazon.in/Fur-Jaden-Camping-Rucksack-Backpack/dp/B07PMWMN19/ref=sr_1_114?crid=2M096C61O4MLT&keywords=bags&qid=1692794798&sprefix=ba%2Caps%2C283&sr=8-114,Fur Jaden Hiking Camping Rucksack Casual 10 Ltrs Blue Casual Backpack,249,3.6,"7,983"
https://www.amazon.in/Gear-Expandable-RainCover-Grey-Black-TLPTURBO00401/dp/B097KDRZ67/ref=sr_1_115?crid=2M096C61O4MLT&keywords=bags&qid=1692794798&sprefix=ba%2Caps%2C283&sr=8-115,Gear Turbo 45L Expandable Water Resistant Antitheft Laptop Bag/Backpack/Briefcase For Men/Women With Raincover (Grey),"1,794",4.3,"1,124"
https://www.amazon.in/American-Tourister-AMT-SCH-BAG02/dp/B07CGLDV2C/ref=sr_1_116?crid=2M096C61O4MLT&keywords=bags&qid=1692794798&sprefix=ba%2Caps%2C283&sr=8-116,American Tourister Casual Backpack,"1,249",4.2,"4,102"
